temporada,numero,titulo,fecha_estreno,puntuacion,descripcion
1,1,Bells,9 Jan. 1986,8.5,Blackadder develops feelings for a woman posing as his male servant.
1,2,Head,16 Jan. 1986,8.4,"Edmund is ""awarded"" the post of Lord High Executioner, a position which frequently results in the loss of one's own head."
1,3,Potato,23 Jan. 1986,8.3,Edmund attempts to impress the Queen by embarking on his own voyage of discovery to the New World.
1,4,Money,5 Feb. 1986,8.2,The president of the Bank of the Black Monks calls upon Blackadder in order to collect a £1000 debt.
1,5,Beer,13 Feb. 1986,8.7,Blackadder finds himself hosting a drinking competition on the same night he is entertaining his puritanical relatives.
1,6,Chains,20 Feb. 1986,8.3,Blackadder and Melchett are kidnapped by a neurotic German spy just after the Queen announces she is sick of paying ransom to kidnappers.
