temporada,numero,titulo,fecha_estreno,puntuacion,descripcion
1,1,Her Ihanet Sevgiyle Baslar,28 Sep. 2009,9.0,"Ezel and his team arrive to Cyprus to avenge Ömer, who has been betrayed by his best friends in 1997, twelve years ago."
1,2,Seni Seven Senin Kurbanindir,5 Oct. 2009,8.6,Ezel begins his revenge. We get to know Eysan's past.
1,3,Ask Ölümden Güclüdür,12 Oct. 2009,8.8,Eysan's motivation for betraying Ömer 12 years earlier is revealed. Ezel learns Eysan's son has endangered himself and decides whether to intervene.
1,4,En Zoru Eve Dönmektir,19 Oct. 2009,8.5,"Back in 1997, an unlikely protector defends Ömer when he is targeted in prison, and Cengiz takes desperate measures to ensure Eysan stays with him."
1,5,"Ask mi Kaderi Kovalar, Kader mi Aski",26 Oct. 2009,9.1,"In 2001, Ömer is mentored by fellow inmate Ramiz and gets a surprise visitor. Four years later, a riot allows him to escape his sentence and identity."
1,6,Hayaller Hayaletler,9 Nov. 2009,8.7,"When Bahar suffers a health crisis, Ezel comes to her rescue. An unexpected stop during a road trip with Cengiz brings Ezel to his family's home."
1,7,Gitmek/Kalmak,16 Nov. 2009,8.2,Ezel selects a target. A newly released Ramiz recalls Ezel's failed attempt at getting revenge in 2005. Bahar steals some time alone with Ezel.
1,8,Akreple kurbaga,23 Nov. 2009,8.8,"Ezel learns Bahar is hiding a secret, and finds a way to spend time with Eysan. Unable to find any dirt on Ezel, Ali investigates his driver, Kamil."
1,9,En kötü ihtimal,30 Nov. 2009,8.8,"Ezel takes Eysan to a nostalgic place. Ali digs up dirt on Ezel's assistant, Sebnem, and makes her an offer. Mert and his mother run into Eysan."
1,10,Sadakat,7 Dec. 2009,9.2,"When Mert's mother, Meliha, is introduced to Ezel at a get-together, she has a strong reaction that makes Cengiz wary. Eysan finds a worrying note."
1,11,Utanç,14 Dec. 2009,8.8,Cengiz and Ali take the bait that Ezel has dangled in front of them. A disturbing text message prompts Eysan to visit her father.
1,12,Yalniz kalmak,28 Dec. 2009,8.7,"When Ali confronts Eysan for visiting her father, she fears the worst has happened to him. Ezel secretly visits his mother, but Mert catches him."
1,13,Kaçinilmaz,4 Jan. 2010,8.8,"Ezel takes Bahar to an orphanage linked to his past. Ali recalls returning to work for Cengiz in 2006, and their love-hate relationship since then."
1,14,ilk Günah,11 Jan. 2010,8.7,"Cengiz remembers running a DNA test on his son in 2006. While seducing Bahar, Ezel feels conflicted. Cengiz catches Eysan taking birth control pills."
1,15,Çikar yol,25 Jan. 2010,8.7,Mert's plans for writing an article about Ömer put his life at risk. Eysan's father secretly develops a relationship with his grandson.
1,16,Dönüs yolu,1 Feb. 2010,8.9,"When Cengiz gets in trouble at a nightclub, Ezel's loyalties from his former life as Ömer are tested. Ezel has a heart-to-heart talk with Bahar."
1,17,Geçmisin ayak izleri,8 Feb. 2010,8.8,"Mert interviews a reluctant Cengiz, Eysan and Ali for his article. Afterward, Ezel and Ali accompany Mert on a fact-finding mission to the prison."
1,18,Gitmesine izin vermek,15 Feb. 2010,9.2,"In order to protect Mert, Ezel makes a painful decision. Eysan follows a hunch about her husband. Mert takes a risk to investigate an anonymous tip."
1,19,Gercekleri Ogrenme Zamani,22 Feb. 2010,8.5,"Worried about her son's future, Eysan decides to introduce Can to Ömer's family. Can reveals to his grandfather that he saw what was on the videotape."
1,20,Emanet,8 Mar. 2010,8.8,Eysan spots her husband with another woman. Cengiz is asked to choose between his friendship with Ali and his partnership with Ezel. Ali tests Ezel.
1,21,Ailede bir olüm,15 Mar. 2010,8.8,Can steals the videotape. Mert changes his mind and publishes an article on Ömer. A haunting message leads Ali to believe he's been cursed.
1,22,Masumiyet,22 Mar. 2010,8.5,Ezel's mother confronts him about his letter to Mert. Ezel asks Bahar to prove her love for him. Paranoia consumes Ali. Eysan salvages her pride.
1,23,Oyunbozan,12 Apr. 2010,8.8,Ali misinterprets the surprise awaiting him at the casino. Eysan's father visits Cengiz with a demand. Ezel leads Eysan to make a shameful move.
1,24,Baslasin intikam,19 Apr. 2010,8.8,Bahar accuses Ezel of breaking a promise. Cengiz scrambles to secure a multi-million-dollar loan in time for submitting a bid for the hotel project.
1,25,Gercegin Gucu,26 Apr. 2010,8.9,"Bahar goes on an upsetting dinner date. Eysan reveals the depth of her hate for her husband. Ezel's sidekicks, Sebnem and Kamil, are caught off guard."
1,26,En Onemli Sey,3 May 2010,8.8,"To save his own life, Cengiz negotiates with his father-in-law. A mission tests Tevfik's loyalties. A conflicted Ezel makes a confession to Eysan."
1,27,Kimin Tarafindasin,10 May 2010,9.1,Cengiz and his father-in-law plan to bait Ezel. Eysan's aunt calls Ezel's mother. Ali tries to flee Turkey. Eysan succumbs to her attraction to Ezel.
1,28,Bizden Biri,17 May 2010,8.9,Tevfik recalls his original crime. Ezel gets Ali to work for him without knowing it. Serdar finds an informant with knowledge of Ezel's past.
1,29,Surgun,24 May 2010,8.8,"After learning Ezel had a second mentor, Serdar and Ali pay her a visit. Mert meets with troubled orphan Eren. Eysan relives a moment from her past."
1,30,Ozlemek,31 May 2010,9.3,"Eren steals a gun and goes to visit Mert. Ali and Serdar raid the home of Ezel's plastic surgeon. To find out who Serdar is, Tevfik picks his pocket."
1,31,Yasama Sebebi,7 Jun. 2010,9.1,Bahar tells Ezel about her upbringing. Mert figures out who betrayed Ömer. Tevfik learns of the videotape. Serdar tracks down Ezel's old taxi driver.
1,32,Haksizliga Karsi,14 Jun. 2010,8.8,"After getting the proof he needs to put away his old friends, Ezel must decide whether to continue with his vengeance or return home to his family."
1,33,Ikinci hayat,21 Jun. 2010,9.1,"At the casino, Ezel and Cengiz literally put their darkest secrets on the table. Ali and Tevfik try to find Serdar before he can make his escape."
2,1,Imkansiz,13 Sep. 2010,9.1,Eren receives the package that Serdar mailed while making his escape. Ramiz gives Tevfik his next mission. Ezel hires Mert for the hotel project.
2,2,Hiçbir seyi olmayan Adam,20 Sep. 2010,8.8,Cengiz suspects Eysan is cheating on him and follows her. Ali persuades Sebnem to play hooky with him. Ezel tries to convince Eysan to leave Cengiz.
2,3,Son kabadayi,27 Sep. 2010,9.2,Ezel asks Ali to join forces with him against Cengiz. A piece of jewelry triggers a flashback that leads Cengiz to a horrifying realization.
2,4,Baslangic - Bitis,4 Oct. 2010,9.1,"Ezel's plans spin out of control when Ramiz mysteriously disappears, Cengiz starts asking too many questions and Eysan makes a life-changing decision."
2,5,Küçük Hayat Büyük Adim,11 Oct. 2010,9.1,Cengiz's tolerance of Eysan's humiliations reaches its limit. Ramiz plays the pitiful victim to regain the upper hand in the casino business.
2,6,Aile güzel bir hayaldir,18 Oct. 2010,8.9,"After making a shocking revelation, Tevfik calls Ali's bluff. Cengiz stalks a man he claims is Eysan's lover. Eysan is shown a note from Ömer."
2,7,Kirli zevklerimiz,25 Oct. 2010,9.1,"Eysan finds out what the key is for. When Cengiz tortures Eysan's supposed lover to make him confess, Ezel feels pressured to give himself up."
2,8,Akil ve kalp,1 Nov. 2010,9.2,"Mümtaz risks his health trying to reunite with Ömer. Refusing to give up his dream of taking down Ramiz, Ali ropes Cengiz and Ezel into helping him."
2,9,Gölge oyunu,8 Nov. 2010,9.1,Mümtaz refuses to have life-saving surgery. Ramiz's only surviving betrayer tells a shocking story that changes the way Ezel views his mentor.
2,10,Iki ev,22 Nov. 2010,9.1,Ezel finds a camcorder with footage that reveals the face of Ramiz's fourth child. Cengiz takes an interest in Ramiz's biographer.
2,11,iki Sehrin Hikayesi,29 Nov. 2010,8.9,Azad is lured into a trap. Bahar issues an ultimatum when she finds her father has manipulated Eysan into providing him refuge in her home.
2,12,ip Ucu,6 Dec. 2010,8.9,"Ezel and Ramiz trick the assassin stalking Azad. Mert reveals his suspicions to Ezel. Bahar meets Ezel, but it's not the reunion she was hoping for."
2,13,Sirdas,13 Dec. 2010,9.2,"Mert visits Ramiz to confirm his suspicions, and later provokes Ali into unconsciously revealing where proof of Ömer's innocence can be found."
2,14,Tanisdigimiz Gün,20 Dec. 2010,9.2,Ezel meets with Mert to reveal his true identity. Ramiz spares Ali's life in exchange for the promise of another's. Can receives a diagnosis.
2,15,Askta ve Savasta,27 Dec. 2010,8.9,"Ramiz finds Cengiz's weakness and leverages it to force him to do his bidding. Ezel, Ali and Eysan play along, aiming to get Cengiz arrested."
2,16,Mutlu Yillara,3 Jan. 2011,9.0,Bahar visits Ezel to tell him of an important decision she's made. Ezel suggests to Cengiz that he take his family on a vacation overseas.
2,17,Saklamak - Gormek,17 Jan. 2011,9.0,Ali is forced to finish a job for Ramiz that will incriminate Cengiz but put his own life at risk. Cengiz experiences exactly what Ömer once did.
2,18,Güzel ve Çirkin,24 Jan. 2011,9.2,"Now that Cengiz has been dealt with, Ezel moves on to his next target: Eysan. But a sudden emotional reaction leads him to make a change in plans."
2,19,Yeni Hayat,31 Jan. 2011,9.0,"Serdar spies on a newly released Ezel making plans with Eysan and Ali, and demands a piece of the action. In court, Eysan takes the witness stand."
2,20,Arda Kalan Her Sey,7 Feb. 2011,9.0,"When Eysan makes a sudden decision that threatens Ezel's plans for getting revenge against her, he throws caution to the wind to change her mind."
2,21,Utanç,14 Feb. 2011,9.1,"Serdar tells Cengiz what he witnessed while spying on Eysan, Ezel and Ali. Eysan begs Bahar for forgiveness. Ali realizes Bahar's cancer has returned."
2,22,Ücüncü Kisi,21 Feb. 2011,8.9,"After warning Eysan about Ezel, Cengiz receives a visit from him. Bahar makes a heartbreaking decision about what she'll do next with her life."
2,23,Ayrilsak da...,28 Feb. 2011,8.9,A mysterious visitor seeks to exchange intel with Cengiz. Ezel makes a shocking declaration to Bahar. Eysan shares her suspicions about Ezel with Ali.
2,24,Tereddütler,7 Mar. 2011,8.7,A visit with Cengiz shatters Ali's trust in Tevfik. Bahar confronts Ali about his betrayal of Ömer. Tevfik has a heart-to-heart talk with Sebnem.
2,25,Nikah ve Cenaze,14 Mar. 2011,9.1,"Tevfik is forced to choose between Ezel and Ali. Bahar asks Ezel a hypothetical question, and later learns her father was involved in betraying Ömer."
2,26,Zamansiz,21 Mar. 2011,8.8,"Cengiz learns the significance of the number 12 etched on his arm. When Ali refuses to give in to Ramiz, Ezel and his team must rescue hostage Tevfik."
2,27,Kurtar Beni,28 Mar. 2011,8.8,"Cengiz is extracted from prison, but must pay a price afterward. Ezel gets himself in a room alone with Ali, who reveals a secret about Tevfik."
2,28,Yasanmamis Hayatlar,11 Apr. 2011,9.3,"Bahar learns Eysan lied in court to put Cengiz in prison, causing her to question her sister's motive for betraying Ömer. Tevfik says his goodbyes."
2,29,Intikam,18 Apr. 2011,9.2,Sebnem goes to see Tevfik one last time. Cengiz lays a trap to get Eysan alone in the house. Eysan and Ezel let go of everything holding them back.
2,30,Kücük hayat büyük Adim,25 Apr. 2011,9.2,Ali receives a clue to the link between Ezel and Ramiz. Eysan learns someone has already bought her confiscated properties. Bahar cuts ties with Ezel.
2,31,Güzel Günler,2 May 2011,9.1,Ali visits the military hospital where Ömer was treated. Eysan confesses her dark sin to Ezel. Mümtaz learns what Cengiz and his friends did to Ömer.
2,32,Güzel Günlerdi,9 May 2011,9.2,Ali is given a chance to redeem himself. Ezel loses a friend. Mümtaz won't forgive himself for not believing that Ömer was innocent.
2,33,Elimde Kalanlar,16 May 2011,9.1,Bahar offers Ali a deal. Meliha questions Mümtaz's closeness to Can. Ezel makes Eysan feel the same way Ömer did when he realized he'd been betrayed.
2,34,Yalniz Bir Adam,23 May 2011,9.2,"Eysan makes a difficult sacrifice, leaving behind a revealing letter. When Ezel goes alone to meet Ramiz's nemesis, he's greeted by a surprise."
2,35,Mükemmel Bir Cinayet,30 May 2011,9.4,"Ali wants to redeem himself by sacrificing his life. Bahar offers words of encouragement to Ezel, who is convinced he's incapable of loving his son."
2,36,Imkansiz Ask Yoktur,6 Jun. 2011,9.0,"Ali accompanies Bahar to the hospital, where she gets test results. Ezel offers Ali a path to redemption. Bahar asks Eysan to do what's best for Can."
2,37,Mutlu Sonlara Kim Inanir?,13 Jun. 2011,8.9,"Cengiz watches helplessly as a horrifying scene unfolds. Ezel learns who masterminded Ömer's betrayal, and what Eysan's motive was for cooperating."
2,38,...Ama Herkes Ölmez,20 Jun. 2011,9.5,"Tevfik stands up against Ramiz. After Ezel hears Kenan's side of the story, he questions Ramiz's trustworthiness. Serdar re-enters Eysan's life."
