temporada,numero,titulo,fecha_estreno,puntuacion,descripcion
1,1,Big Bang,25 Apr. 2010,8.1,"This is the greatest story ever told, the creation of everything us. The programme investigates how the Universe came into existence out of nothing, and how it grew from a miniscule point, smaller than an atomic particle, to the vast cosmos we see today."
1,2,Black Holes,2 May 2010,8.4,"Black Holes,the most powerful destroyers in the Universe, the most mysterious phenomena in the heavens. For years they were only speculation, now modern astronomy is proving them frighteningly real and showing that they may well shape everything we see."
1,3,Galaxies,10 May 2010,8.3,"Galaxies, home to stars, planets and us, come in all shapes and sizes. Witnesses the evolution of galaxies; from clouds of cold gas floating in the voids of space 13 billion years ago, to the magnificent spirals that fill our night sky."
1,4,Stars,10 May 2010,8.4,"The story of how stars were made by the Universe and how Stars then went on to engineer everything else in that very universe. They changed the Universe by spawning further generations of stars, then planets and eventually the building blocks of life."
1,5,Supernovas,17 May 2010,8.2,"Stars are not eternal; they are dying in unimaginably large explosions called supernovas. Second only to the Big Bang, these explosions are where creation and destruction meet. Only now have we begun to understand how these wonders in our sky work."
1,6,Planets,17 May 2010,8.2,"There are just eight planets in our solar system, but there could be a hundred billion planets in our Milky Way galaxy alone. This show follows the journey of planets as they grow from grains of dust to the magnificently diverse worlds we see today."
1,7,Solar Systems,24 May 2010,8.1,"Is our solar system unique? Since the first discovery of a planet orbiting another star, some 280 alien solar systems have been identified. It's only by looking at solar systems far beyond our own, that we can understand how remarkable our universe is."
1,8,Moons,24 May 2010,8.3,"Moons come in every possible shape and size. Home to incredible natural phenomena like gigantic geysers and colossal volcanoes, moons also offer perhaps the best chance of finding alien life in the Universe - and they probably exist in the billions."
2,1,Volcanoes,11 Jul. 2012,7.7,"Scientists are discovering volcanoes on worlds we once thought dead. From our nearest planetary neighbour to tiny moons billions of miles away, today we are discovering volcanoes on alien worlds. Are these worlds where, tomorrow, we might find life?"
2,2,Megastorms - The Winds of Creation,18 Jul. 2012,7.8,"On Earth, violent and destructive storms create new opportunities for life. In our quest to discover if we are alone in the universe, we shouldn't just look for worlds, we should look for weather. Find chaotic weather and maybe we will find alien life."
2,3,Planets from Hell,25 Jul. 2012,7.9,"Over the last twenty years we have discovered an extraordinary zoo of planetary nightmares outside our own solar system, all of them truly wild worlds, a collection of monsters. Now we must face the question: Is every planet out there a planet from hell?"
2,4,Megaflares - Cosmic Firestorms,1 Aug. 2012,7.7,"The Universe is a magnetic minefield. The Sun spits out flares capable of battering life on Earth. But out there in space lie the true magnetic monsters. As we uncover dangerous megaflares in the cosmos, the question is, will we end up in the firing line?"
2,5,Extreme Orbits - Clockwork and Creation,8 Aug. 2012,7.9,"The only reason life on Earth is possible is because of our stable orbit around the Sun. Elsewhere in the Universe, orbits are chaotic, violent and destructive. On the largest scale, orbits are a creative force and construct the fabric of the Universe."
2,6,Comets - Frozen Wanderers,15 Aug. 2012,7.9,"We follow the odyssey of a comet as it sails through space, watching every move as it evolves from a chunk of ice and rock into an active nucleus engulfed in a gaseous haze. What we learn is a revelation; comets are even more mysterious than we imagined."
2,7,Asteroids - Worlds That Never Were,22 Aug. 2012,8.0,"From icy worlds with more fresh water than Earth to flying mountains of pure metal, asteroids shaped our past and promise much for the future. Could these enigmatic space rocks hold the key to how life in the Universe arises and is extinguished?"
2,8,Birth of the Earth,29 Aug. 2012,8.3,"The Earth was formed by a series of cosmic cataclysms including the most powerful blast in the Universe. Yet amid the turmoil our world was born. Could the same chain of events have created other earths elsewhere, inhabited by creatures like us?"
3,1,Journey from the Center of the Sun,9 Jul. 2014,8.2,"How does light escape from the sun? We take a journey from the center of the sun, following the path of light. We witness its fiery birth from in the core, its 430,000 mile battle against gravity and magnetism, and its escape from the solar surface."
3,2,The End of the Universe,16 Jul. 2014,8.9,"How and when will the Universe end? Gravity and dark matter are poised to annihilate the Universe in a big crunch. Expansion and dark energy may tear it apart. Or, a phase transition could kill us tomorrow in a cosmic death bubble."
3,3,Jupiter: Destroyer or Savior?,23 Jul. 2014,8.7,"Beneath Jupiter's swirling clouds lie our solar system's deepest secrets: from its violent youth, through the birth of life to the death of the sun. Now, scientists are unlocking these secrets and discovering that every living thing exists tha to Jupiter."
3,4,First Second of the Big Bang,30 Jul. 2014,8.4,"The first second of the Universe, the creation of everything when space, time, matter and energy burst into existence. It is the most important second in history, which seals the Universe's fate and defines everything that comes after - including us."
3,5,Is Saturn Alive?,6 Aug. 2014,8.4,"Saturn's secrets are out. The ferocious weather, the evolving ring system and the discovery of active geology on Saturn's moons has rewritten the textbooks. Scientists are looking for life on Saturn's moons and they may have found it on Titan."
3,6,Weapons of Mass Extinction,13 Aug. 2014,8.5,An overview of historical mass extinctions and what is in store for the future.
3,7,Did a Black Hole Build the Milky Way?,20 Aug. 2014,8.4,"What built the Milky Way? New research might now have the answer, revealing an unlikely hero. At the heart of our galaxy sits a super massive black hole, one of the most destructive objects in the Universe. Could it be our creator?"
3,8,Our Voyage to the Stars,27 Aug. 2014,8.6,"One day, a cosmic disaster will make life on Earth impossible. To survive, we must find a new home amongst the stars. Scientists are already developing new propulsion systems to take us to these distant worlds."
3,9,The Search for a Second Earth,3 Sep. 2014,8.7,"Is there another Earth out there with liquid oceans, rocky continents and life like us? Astronomers seek the answer with spectroscopy, direct imaging and telescopes. They hope to find evidence of atmospheres, magnetospheres and signs of life."
4,1,How the Universe Built Your Car,14 Jul. 2015,8.1,"Beneath the hood of your car lies the history of the Universe. The iron in your chassis, the gold in your stereo and the copper in your electronics all owe their existence to violent cosmic events that took place billions of years ago."
4,2,"Earth, Venus's Evil Twin",15 Jul. 2015,7.8,There is a hellish planet in our solar system; covered in thick dense clouds and roasted by colossal temperatures. Incredibly this is a vision of Earth's future. To understand how our world will be destroyed we need to look at Earth's evil twin Venus.
4,3,Monster Black Hole,22 Jul. 2015,8.6,"Black holes are the least understood places in the universe, where the rules of physics collapse. We go inside the super-massive black hole in the center of the Milky Way."
4,4,Edge of the Solar System,4 Aug. 2015,8.7,"Giant magnetic bubbles millions of miles wide, bizarre invisible matter, and a death star tearing through bands of icy comets, flinging them into violent orbits. All this and more could be inside our cosmic backyard, and effecting our lives on Earth."
4,5,Dawn of Life,11 Aug. 2015,8.6,We're on the verge of unconvering the how life on Earth came to be. Our origin is a hotly contested scientific debate. Did we come from strange volcanic hatcheries deep under the sea? Or did life on Earth come from another planet?
4,6,Secret History of the Moon,18 Aug. 2015,8.5,"Our Moon is stranger than you think, and we reveal its incredible secrets. Can we thank the Moon for life on Earth? What explains the mysterious tunnels beneath its surface? Is a lunar base the key to humanity's future in space?"
4,7,The First Oceans,25 Aug. 2015,8.6,"For years, scientists suspected that the oceans came from molecules delivered to Earth from distant stars by asteroids, but a new discovery suggests that their true origins may be more exotic."
4,8,Forces of Mass Construction,1 Sep. 2015,8.5,"There's a mysterious force you can't see or touch, but it affects everything in the universe. Magnetism has shaped our cosmos, and without it, Creation would simply disintegrate. We follow scientists trying to understand how this strange force works."
5,0,Most Amazing Discoveries,22 Nov. 2016,8.2,"From the furthest reaches of space to our own cosmic backyard, we count down the discoveries that changed everything we know about our universe."
5,1,The Mystery of Planet 9,23 Nov. 2016,8.7,"Scientists have discovered a mysterious ninth planet on the very edge of our solar system. Ten times the size of Earth, this strange world could have moons with extraterrestrial life."
5,2,Black Holes: The Secret Origin,6 Dec. 2016,8.3,"The question in every galaxy and super anomaly students and viewers minds are how do black holes grow so massive. For every possible solution, there exists a different cause. The study continues."
5,3,Secret History of Pluto,20 Dec. 2016,8.4,"Astronomers discovered a host of other icy objects orbiting around Pluto. Renewed interest was piqued, especially after a New Horizons probe took some high-resolution photos of Pluto in 2015."
5,4,Stars That Kill,10 Jan. 2017,8.3,"The universe is home to real-life Death Stars that could destroy planet Earth. The latest science reveals the terrifying secrets of NASA's six deadliest: vampire stars, supernovas that can vaporize a planet, and unpredictable stars gone rogue."
5,5,The Universe's Deadliest,11 Jan. 2017,8.0,"The ultimate guide to the worst places in the universe. There is Betelgeuse in its death throes and could become a supernova and the possibly a death star. Chuck, the crash-test dummy will be sent on travels to other deadly events,"
5,6,Life and Death on the Red Planet,24 Jan. 2017,8.1,Life on Mars went through a series of life impacting events and the first impact may have seeded life on earth by debris from Mars..
5,7,The Dark Matter Enigma,31 Jan. 2017,7.6,"Dark matter is the biggest mystery of the cosmos. Scientists know that it has been vital to the universe since its birth, new discoveries reveal that it could create black holes, cause mass extinctions, and might even have helped to shape life on the Earth. Might there be a dark matter universe that may account for all the events that aren't really definable? This is all pure speculation and if's."
5,8,Strangest Alien Worlds,6 Feb. 2017,8.0,"Discoveries of new planets have revealed countless worlds much stranger than Earth. Some of these strange worlds don't have stars, others are made out of diamonds. Will we ever find a planet like Earth, or are these distant worlds stranger than fiction?"
6,1,Are black holes real,4 Feb. 2018,8.6,"Various eminent scientists explain the current knowledge of Black Holes and try to answer the question, do they really exist? The two great theories of Einstein's General Relativity and Quantum Mechanics don't work together to explain Black Holes which is a big problem. Other theoretical constructs such as Gravastars and Planck stars have been postulated but proving their existence is just as difficult as that of Black Holes. So where next?"
6,2,Twin Suns: The Alien Mysteries,16 Jan. 2018,8.4,"Planets that orbit two suns instead of one might be deadly hell worlds, but new discoveries reveal that sci-fi star systems with binary stars might be optimal places for alien life."
6,3,Dark History of the Solar System,23 Jan. 2018,8.4,"Our solar system hides a dark and violent past, and new discoveries reveal that Earth and the planets were formed from the destruction of alien worlds that came before us."
6,4,Death of the Milky Way,30 Jan. 2018,8.1,"The Milky Way is dying, and using the latest science and discoveries, experts are investigating what's killing it."
6,5,Uranus & Neptune: Rise of the Ice Giants,6 Feb. 2018,8.4,"Uranus and Neptune are mysterious, icy worlds at the edge of our solar system, and new discoveries reveal that these strange planets may have helped start life on Earth."
6,6,Secret History of Mercury,13 Feb. 2018,8.4,Mercury has a dangerous secret that may one day threaten life on Earth.
6,7,The Quasar Enigma,20 Feb. 2018,8.5,"Quasars are the brightest and most powerful objects in our universe, and though they have shaped the cosmos, they might ultimately destroy everything that exists."
6,8,Strange Lives of Dwarf Planets,27 Feb. 2018,8.7,"New discoveries reveal the secrets of hundreds of strange, tiny worlds called dwarf planets."
6,9,War on Asteroids,6 Mar. 2018,8.4,"Scientists discuss various types of asteroids, previous collisions between asteroids and Earth, and various technologies that may be employed to stop future collisions. Also discussed are ways in which nature can prevent or lessen the impact of collisions."
6,10,Mystery of Spacetime,13 Mar. 2018,8.5,"Spacetime is the secret structure that controls our universe, time, light, and energy."
7,1,Nightmares of Neutron Stars,8 Jan. 2019,8.9,"Neutron stars are strange and violent phenomena that defy the laws of physics, and new discoveries reveal that these bizarre nightmares are far more deadly than previously believed, with the power to destroy planets and even other stars."
7,2,When Supernovas Strike,15 Jan. 2019,8.8,"Supernovas are the violent death of giant stars, and new discoveries reveal that these cataclysmic events create the elements that are essential to all life in the universe."
7,3,The Interstellar Mysteries,22 Jan. 2019,8.6,"Discoveries about interstellar space, the space between the universe's stars, reveal that it's not empty and unremarkable as previously thought, but filled with weird objects and strange phenomena that might hold the darkest secrets of the cosmos."
7,4,How Black Holes Made Us,29 Jan. 2019,8.2,"Black holes are not the violent monsters people think they are, and new discoveries reveal that they might have been essential to creating stars, giving light, and building the universe itself."
7,5,Secret World of Nebulas,5 Feb. 2019,8.1,"Nebulas are the strange structures of cosmic gas and dust where stars are born and die, and new discoveries reveal the secrets of these mysterious places."
7,6,Did the Big Bang Really Happen?,12 Feb. 2019,8.4,"New discoveries are causing astronomers to question if the Big Bang really happened, and using the latest science, they investigate if it wasn't just the start of our universe but many mysterious multiverses."
7,7,Battle of the Dark Universe.,19 Feb. 2019,8.0,"Dark matter and dark energy are locked in an epic battle for control of the cosmos, and the winner will determine the fate of the universe. New discoveries might reveal which force will emerge victorious."
7,8,Hunt for Alien Life,26 Feb. 2019,8.1,"The latest discoveries suggest that we might be on the verge of discovering life beyond our planet, and scientists are investigating if earth's life began elsewhere in the universe, and whether we need to evolve to know for sure."
7,9,Finding the New Earth,5 Mar. 2019,8.6,"New discoveries have revealed thousands of exoplanets beyond the solar system. Some resemble earth enough that one could be a new home for humanity. Even with cutting-edge technology, finding the perfect one is the scientific challenge of the age."
7,10,Cassini's Final Secrets,12 Mar. 2019,9.1,"For twenty years, NASA's Cassini spacecraft revealed the strange secrets of Saturn until it vaporized in its atmosphere in a blaze of glory. But today its legacy lives on, as fresh data from the probe helps scientists make brand-new discoveries."
8,1,Asteroid Apocalypse: The New Threat,2 Jan. 2020,7.6,"If a massive asteroid collides with Earth, it could end life on the planet as one knows it."
8,2,NASA's Journey to Mars,9 Jan. 2020,7.9,"NASA is on a mission to send humans to Mars within just 15 years, but to reach this next frontier of space exploration, experts must discover new technology and cutting-edge science that protects astronauts from the Red Planet's deadliest killers."
8,3,Hunt for Alien Evidence,16 Jan. 2020,8.0,"The discovery of extraterrestrial life might face an impossible challenge: the physics of the universe itself; but using cutting-edge tech, experts might be on the verge of a groundbreaking find - and the evidence could already be in hand."
8,4,Death of the Last Stars,23 Jan. 2020,8.5,"Our universe's stars are dying off faster than new ones are born, and using the latest technology, experts investigate the secrets of the last stars of the cosmos and what this stellar apocalypse means for life on earth."
8,5,Secrets of Time Travel,30 Jan. 2020,8.5,"A look at the concepts behind changing the way we travel through the space-time continuum, and how extreme speed and extreme gravity can change the rules of the game."
8,6,When NASA Met Jupiter,6 Feb. 2020,8.4,"NASA's Juno spacecraft is part of a cutting-edge mission to explore the mysteries of Jupiter. As this mighty probe is pummeled with deadly radiation, it gathers new data that could change everything we know about the solar system's biggest planet."
8,7,Edge of the Universe,13 Feb. 2020,8.6,"We don't yet know where the edge of the universe is or what happens there; but thanks to cutting-edge technology and new discoveries, experts might finally reveal the secrets of the phenomena that can be found in deepest reaches of the cosmos."
8,8,Monsters of the Milky Way,20 Feb. 2020,8.6,"The center of the Milky Way is home to strange and deadly phenomena that we don't yet understand, but using the latest science, experts are revealing how the super-massive black hole at our galaxy's core shapes life on Earth."
8,9,Earth's Death Orbit,27 Feb. 2020,8.6,"Earth's journey through the universe is a perilous one, and new discoveries reveal that our planet is heading toward a mysterious area of the cosmos that could eject us out of the Milky Way and into oblivion."
8,10,Pluto's Strangest Secrets,7 May 2020,0.0,
8,11,Mysteries of Alien Stars,11 May 2020,0.0,
8,12,Asteroid Apocalypse,26 May 2020,0.0,
8,13,Attack of the Asteroids,1 Jun. 2020,0.0,
8,14,Forces of the Unknown,8 Jun. 2020,0.0,
9,1,Asteroid Apocalypse: The New Threat,2 Jan. 2020,7.6,"If a massive asteroid collides with Earth, it could end life on the planet as one knows it."
9,2,NASA's Journey to Mars,9 Jan. 2020,7.9,"NASA is on a mission to send humans to Mars within just 15 years, but to reach this next frontier of space exploration, experts must discover new technology and cutting-edge science that protects astronauts from the Red Planet's deadliest killers."
9,3,Hunt for Alien Evidence,16 Jan. 2020,8.0,"The discovery of extraterrestrial life might face an impossible challenge: the physics of the universe itself; but using cutting-edge tech, experts might be on the verge of a groundbreaking find - and the evidence could already be in hand."
9,4,Death of the Last Stars,23 Jan. 2020,8.5,"Our universe's stars are dying off faster than new ones are born, and using the latest technology, experts investigate the secrets of the last stars of the cosmos and what this stellar apocalypse means for life on earth."
9,5,Secrets of Time Travel,30 Jan. 2020,8.5,"A look at the concepts behind changing the way we travel through the space-time continuum, and how extreme speed and extreme gravity can change the rules of the game."
9,6,When NASA Met Jupiter,6 Feb. 2020,8.4,"NASA's Juno spacecraft is part of a cutting-edge mission to explore the mysteries of Jupiter. As this mighty probe is pummeled with deadly radiation, it gathers new data that could change everything we know about the solar system's biggest planet."
9,7,Edge of the Universe,13 Feb. 2020,8.6,"We don't yet know where the edge of the universe is or what happens there; but thanks to cutting-edge technology and new discoveries, experts might finally reveal the secrets of the phenomena that can be found in deepest reaches of the cosmos."
9,8,Monsters of the Milky Way,20 Feb. 2020,8.6,"The center of the Milky Way is home to strange and deadly phenomena that we don't yet understand, but using the latest science, experts are revealing how the super-massive black hole at our galaxy's core shapes life on Earth."
9,9,Earth's Death Orbit,27 Feb. 2020,8.6,"Earth's journey through the universe is a perilous one, and new discoveries reveal that our planet is heading toward a mysterious area of the cosmos that could eject us out of the Milky Way and into oblivion."
9,10,Pluto's Strangest Secrets,7 May 2020,0.0,
9,11,Mysteries of Alien Stars,11 May 2020,0.0,
9,12,Asteroid Apocalypse,26 May 2020,0.0,
9,13,Attack of the Asteroids,1 Jun. 2020,0.0,
9,14,Forces of the Unknown,8 Jun. 2020,0.0,
