temporada,numero,titulo,fecha_estreno,puntuacion,descripcion
7,24,The Supreme Court,27 Sep. 2020,8.0,USA is appointing a new supreme court judge in the wake of Ruth Bader Ginsberg's death. John Oliver discusses what it means for the future of the Supreme Court and the country. He describes why the selection might become detrimental for the progressive advancement of the people. He also points out the ways to fix the present unfair electoral system which fails to represent the people in the senate and house according the population of the country.
7,25,Election 2020,4 Oct. 2020,7.8,"Weeks out from the 2020 presidential election, John takes a look at various efforts to destabilize the vote, how to ensure your ballot is properly counted, and why in this election the election night should be considered an election month."
7,26,W.H.O.,18 Oct. 2020,8.0,"John talks about the functions of World Health Organization and why it is a vital part of the upcoming US election. John points out the important contribution WHO made over the years, explains the reason why USA pays more than other countries and describes the mistakes of this highly impactful organization. Also, an emotional conclusion to John's Danbury, Connecticut arc."
7,27,Asylum,25 Oct. 2020,7.6,"With the 2020 election underway, John Oliver explains how the Trump administration has handled asylum seekers over the past four years, why it matters, and what we can do about it."
7,28,Coronavirus,1 Nov. 2020,8.1,"John Oliver takes a look at how the Trump administration has handled the coronavirus outbreak in the US, from lack of preparation, to mangled coordination, to harmful communication."
