temporada,numero,titulo,fecha_estreno,puntuacion,descripcion
1,1,POM Wonderful v. Coca-Cola,27 Apr. 2014,8.4,"John talks about the Indian election, Pom Wonderful, and talks with the former NSA director General Keith Alexander."
1,2,Capital Punishment,4 May 2014,8.0,"John talks about the recent issues of the death penalty, François Hollande, and the rising issues happening in Brunei."
1,3,Climate Change Denial,11 May 2014,8.0,"John talks about Eurovision, Ukraine and Russia's relations, and invites Bill Nye to a statistically representative climate change debate."
1,4,The Right to Be Forgotten,18 May 2014,7.9,"John talks about the product recall going on at General Motors, the EU Court of Justice ""Right to be Forgotten"" ruling, and updates us on how the Indian election is going, with help from Fareed Zakaria."
1,5,Net Neutrality,1 Jun. 2014,8.7,"This week's topics include the rise of the far right political parties in Europe, the Ukrainian election, Afghanistan, Net Neutrality, Australia's hard-line right-wing Prime Minister Tony Abbott, and the 2014 Scripps National Spelling Bee."
1,6,FIFA and the World Cup,8 Jun. 2014,8.5,John Oliver discusses the anniversary of the Tiananmen Square rebellion and the FIFA World Cup and invites Right Said Fred to send a message to Bashar al-Assad.
1,7,Immigration Reform,15 Jun. 2014,8.0,"John discusses immigration, the Washington Redskins and Iraq and talks to Stephen Hawking."
1,8,Dr. Oz,22 Jun. 2014,8.1,"John highlights recent news such as the problems of tourism in Antarctica, discusses international royalty as a service to Game of Thrones fans and panders to the audience in response to allegations against Dr. Oz."
1,9,Burwell v. Hobby Lobby,29 Jun. 2014,7.6,John Oliver sheds light on recent Supreme Court cases and discusses gay rights in Uganda with activist Pepe Julian Onziema.
1,10,Income Inequality and Wealth Inequality,13 Jul. 2014,7.9,"John revisits news of a change in Japan's foreign policy, the love letters of Warren G. Harding and CIA's social media activity, and discusses the issues of income inequality in America."
1,11,Incarceration in the United States,20 Jul. 2014,8.0,"John talks about Gaza (but mostly Anderson Cooper) and about Malaysia Airlines flight 17, then discusses prison incarcerations in America and sings with muppets from Sesame Street."
1,12,Nuclear Weapons and the United States,27 Jul. 2014,8.1,"John addresses the Islamic State in Iraq and Syria, revisits the subject of international royalty, discusses the safety of nuclear weapons and campaigns to save geckos in space."
1,13,Native Advertising,3 Aug. 2014,7.8,John discusses native advertising and Argentine debt restructuring.
1,14,Payday Loans,10 Aug. 2014,7.9,John discusses payday loans and Russia's import embargo on U.S. chicken and soybean.
1,15,Shooting of Michael Brown and Police Militarization,17 Aug. 2014,7.8,"Focuses on the shooting of Michael Brown and police militarization in Ferguson, MO. John also discusses the topic of equal pay for equal work."
1,16,Student Debt,7 Sep. 2014,8.0,"John provides a eulogy for the mating space geckos, and talks about student debt."
1,17,Scottish Independence Referendum,14 Sep. 2014,8.0,John discusses the Scottish independence referendum and corporations using Twitter.
1,18,"United States Embargo Against Cuba, Miss America 2015",21 Sep. 2014,8.1,John focuses on the Miss America 2015 pageant with special guest Kathy Griffin.
1,19,Drones,28 Sep. 2014,7.9,John discusses U.S. military drones and the Kansas state budget shortfall.
1,20,Civil Forfeiture,5 Oct. 2014,8.5,John Oliver shows us how desperate the American law enforcement are to make money out of everyone.
1,21,Military Translators,19 Oct. 2014,8.2,"Translators who have aided the U.S. Military in Afghanistan and Iraq are in great danger in their home countries, but red tape is making it impossible for many of them to leave."
1,22,Sugar,26 Oct. 2014,7.9,John Oliver is back to discuss how the sugar industry rules the world!
1,23,State Legislatures and ALEC,2 Nov. 2014,8.0,"John disusses robot sales associates at Lowe's, U.S legislatures in elections, and the American Legislative Exchange Council (ALEC)."
1,24,The Lottery,9 Nov. 2014,8.6,Last Week Tonight features in-depth and critical look at state lotteries. It also looks at the Turkish Prime Minister's Grand Palace and a Salmon shooting cannon.
2,1,Marketing to Doctors,8 Feb. 2015,8.3,John Oliver discusses the growing issues of pharmaceutical companies marketing directly to and through doctors.
2,2,Tobacco,15 Feb. 2015,8.7,"John riffs on Ecuadorian President Rafael Correa, '50 Shades of Grey', and the unethical legal practices of tobacco company Phillip Morris International."
2,3,Judicial Elections,22 Feb. 2015,8.0,"John discusses United Kingdom general elections, judicial elections, and the Chinese New Year."
2,4,Infrastructure,1 Mar. 2015,8.2,"John demonstrates the importance of infrastructure with a special sketch starring Edward Norton, Vincent D'Onofrio, and Steve Buscemi. He also discusses Boris Nemstov."
2,5,U.S. Territories,8 Mar. 2015,8.3,"John Oliver discusses a Fanta controversy in Germany, citizenship grievances for those in U.S. territories, and cigarette packaging."
2,6,The NCAA,15 Mar. 2015,8.2,The NCAA doesn't pay students athletes because they are considered to be amateurs. They are considered to be amateurs because they don't get paid.
2,7,Municipal Violations,22 Mar. 2015,8.0,"If you have money, committing a municipal violation may pose you a minor inconvenience. If you don't, it can ruin your life."
2,8,Government Surveillance,5 Apr. 2015,9.4,John heads to Russia to interview Edward Snowden as part of a segment on government surveillance.
2,9,IRS,12 Apr. 2015,7.6,"John discusses the Internal Revenue Service (IRS), with a special appearance from Michael Bolton."
2,10,Patents,19 Apr. 2015,7.9,"John discusses patents, Earth Day, and doomsday, with a special appearance from Martin Sheen."
2,11,Fashion,26 Apr. 2015,8.1,John Oliver explores the concept of changing and cheap fashion and some of the ugliest truths of the manufacturing process.
2,12,Standardised Testing,3 May 2015,7.9,John discusses standardized testing.
2,13,Paid Family Leave,10 May 2015,8.0,"John discusses Victory Day in Russia, paid parental leave, and Japanese government mascots."
2,14,Chickens,17 May 2015,8.0,John discusses chicken farming.
2,15,FIFA,31 May 2015,8.7,John discusses the 2015 FIFA corruption case.
2,16,Bail,7 Jun. 2015,8.3,John explains why America's bail system is better for the reality TV industry than it is for the justice system.
2,17,Torture,14 Jun. 2015,8.3,"John discusses the 2015 European Games, the Canadian Senate expenses scandal, and torture with the voice of special guest Helen Mirren."
2,18,The Internet,21 Jun. 2015,8.1,"Online harassment is a major problem, but it is rarely prosecuted. If only we'd been warned about this in the early days of the internet."
2,19,Transgender Rights,28 Jun. 2015,8.0,"John discusses US Supreme Court decisions on gay marriage and Obamacre, former President of Ukraine, Viktor Yanukovych, transgender rights and leap second."
2,20,Stadiums,12 Jul. 2015,8.2,John discusses how taxpayer money is funding private sports stadiums.
2,21,Food Waste,19 Jul. 2015,8.5,Iran nuclear treaty; El Chapo prison escape; North Korea hosting Laibach band; food waste.
2,22,Mandatory Minimums,26 Jul. 2015,8.4,"John explains why mandatory minimum sentences, especially for drug-related crimes, are in desperate need of reform."
2,23,District of Columbia,2 Aug. 2015,8.2,"John explains why Washington, D.C. deserves to be the 51st state - or at least get full voting rights in Congress."
2,24,Sex Ed,9 Aug. 2015,8.8,Sex education in America; GOP Debate; India's short-lived porn-site ban; overpricing at Whole Foods.
2,25,Church,16 Aug. 2015,9.3,"John discusses predatory churches and TV evangelism, the raising of the American flag in Cuba, the redesign of New Zealand's flag, and President Harding's illegitimate child."
2,26,LGBT Anti-Discrimination,23 Aug. 2015,8.2,"Despite the victory for marriage equality this summer, there is a long way to go to end LGBT discrimination, as John explains."
2,27,Public Defenders,13 Sep. 2015,8.3,"John talks about problems concerning public defenders in the American Judicial system, a Michigan state legislature scandal, Guatemala's unusual election, and Queen Elizabeth II and delivers a message from the Lady of Perpetual Exemption."
2,28,Migrants and Refugees,27 Sep. 2015,8.0,John talks about Pope Francis visiting the USA and the immigration crisis in Europe.
2,29,Mental Health,4 Oct. 2015,8.0,"John discusses Russia's involvement in Syria, the U.N. General Assembly, and the problems with the national system for treating mental illness."
2,30,North Dakota,11 Oct. 2015,7.8,John takes a look at the harmful effects of the oil boom in North Dakota.
2,31,Canada,18 Oct. 2015,8.1,John discusses the upcoming Canadian election and urges Canadians not to vote for Stephen Harper.
2,32,Medicaid Gap,1 Nov. 2015,7.9,"Main story: Election 2015 and the Medicaid Gap; plus, China & Kenny G.; Syria peace talks; 'Star Wars' impact on Ukraine elections; United Kingdom tax credit vote."
2,33,Prisoner Re-Entry,8 Nov. 2015,8.1,"United Kingdom proposed online mass surveillance law, Veterans Day, Washington Redskin trademark, Prisoner Reentry. Interview with Bilal Chapman."
2,34,Daily Fantasy Sports,15 Nov. 2015,8.2,"John talks about the recent Paris attacks, China's Singles Day, the Koh-i-Noor diamond and Daily Fantasy Sports."
2,35,Pennies,22 Nov. 2015,8.3,John reflects about the Paris attacks aftermath and how useless the U.S. penny is.
3,1,Voting,14 Feb. 2016,8.2,"John talks about the late Antonin Scalia and the Supreme Court, Chipotle's food safety problems, Voter IDs and New Zealand's economic development minister Steven Joyce."
3,2,Abortion Laws,21 Feb. 2016,8.5,"John talks about the South Carolina Republican primary, the Supreme Court vacancy and abortion laws."
3,3,Donald Trump,28 Feb. 2016,9.3,"John talks about the Egyptian president and economic crisis, the Guantanamo Bay shutdown and Donald Trump."
3,4,Special Districts,6 Mar. 2016,7.8,"John talks about special districts, local elections, US election 2016 and of course Donald Trump again."
3,5,Encryption,13 Mar. 2016,8.2,"John talks about latest US election updates, International women's day, Apple's encryption battle with the FBI."
3,6,The Wall,20 Mar. 2016,8.4,"John talks about latest Brazil demonstrations, the nomination of Merrick Garland to join the supreme court And the wall Donald Trump wants to build and how it would be very costly, ineffective and useless."
3,7,Political Fundraising,3 Apr. 2016,7.8,"Congressional Fund-raising with guest Steve Israel- Episode explores the ways congress does fund-raising focusing on cold calls, similar to call centers."
3,8,Credit Reports,10 Apr. 2016,8.0,"John talks about the Panama papers leak, Alabama governor sex scandal, Credit reports and background checks companies and how their results can be false and unreliable."
3,9,Lead,17 Apr. 2016,7.8,"John covers the Flint water crisis, the Böhmermann affair, and Vladimir Putin's call-in show."
3,10,Puerto Rico,24 Apr. 2016,8.1,"Obama's visits to the UK and Saudi Arabia, the ongoing debt crisis in Puerto Rico, and Norway's policy towards asylum seekers are all discussed."
3,11,Scientific Studies,8 May 2016,8.7,"Main story: Scientific Studies; plus, Philippines' presidential frontrunner Rodrigo Duterte, Workers' Party Congress in North Korea; And Now: ""The Next President of the United States."""
3,12,911,15 May 2016,8.1,"John Oliver gives an open invitation to Trump's 1980s PR man alter ego ""John Miller"" then reports on the 911 phone system's failures to keep up with the new issues from so many mobile device users."
3,13,Primaries and Caucuses,22 May 2016,7.9,"John covers Venezuela's current economic crisis, Canadian Prime Minister Justin Trudeau's recent parliamentary incident, and outlines issues surrounding the delegate selection process used in state primaries and caucuses."
3,14,Debt Buyers,5 Jun. 2016,8.6,"John lays out documents recently released in the ongoing lawsuit against one of Donald Trump's business venture's, Trump University. In the main story, John explains the ins and outs and sometimes shady dealings of the debt buying industry."
3,15,Money,12 Jun. 2016,8.1,"Tonight's main story focuses on navigating the complex financial labyrinth of retirement plans, including hints to get through the maze. John also highlights the emerging social media war between 2016 presidential candidates Hillary Clinton and Donald Trump."
3,16,United Kingdom,19 Jun. 2016,8.1,"The main story tonight concerns the upcoming in/out referendum regarding the UK's future status in the EU. John muses both sides of the issue, yet despite being torn, eventually endorses a position in what has become his own unique style. John also examines the NRA's political influence over gun legislation."
3,17,Doping,26 Jun. 2016,7.9,John talks about Brexit and the handling of doping issues by the Olympics management and doping in general.
3,18,Republican National Convention,24 Jul. 2016,8.3,"John talks about US election 2016, Republican National Convention, appointment of Boriss Johnson as UK Foreign Secretary, unauthorized use of songs in political campaigns and a bit more about Donald Trump."
3,19,DNC vs. RNC,31 Jul. 2016,8.1,Highlights of US Democratic Party convention 2016.
3,20,Journalism,7 Aug. 2016,8.3,John talks about the Olympics Opening Ceremony and the main story is about Journalism and the descent of printed news.
3,21,Auto Lending,14 Aug. 2016,8.1,"John talks about the 2016 US election, American Petroleum Institute copying ""Last Week Tonight with John Oliver"" credits and how auto lenders can trap vulnerable people in debt."
3,22,Charter Schools,21 Aug. 2016,8.0,"John talks about Rio Olympics controversies especially about Ryan Lochte, lack of oversight on Charter Schools, and a bit more about Donald Trump."
3,23,Scandals,25 Sep. 2016,8.2,John Oliver talks about the scandals involving Donald Trump and Hillary Clinton.
3,24,Police Accountability,2 Oct. 2016,8.1,John Oliver looks at the police accountability system. He also talks about the first debate between Donald Trump and Hillary Clinton.
3,25,Guantánamo,9 Oct. 2016,8.1,"John talks about Guantanamo Bay detention camp, Donald Trump controversies and Head of the Chechen Republic Ramzan Kadyrov."
3,26,Third Parties,16 Oct. 2016,7.8,John Oliver considers third party candidates as potential presidents.
3,27,Drugs,23 Oct. 2016,8.0,"John talks about opioids, the final presidential debate and Donald Trump's charity roast."
3,28,School Segregation,30 Oct. 2016,8.0,John talks about Public schools in USA that are increasingly segregated by race and class. He discusses the troubling trend towards school resegregation.
3,29,Multilevel Marketing,6 Nov. 2016,8.4,John Oliver talks about the legitimacy of Multilevel marketing companies that seem pyramid shaped. He also talks a bit about USA election 2016 once more.
3,30,President-Elect Trump,13 Nov. 2016,8.7,John Oliver talks about the election results.
4,1,Trump vs Truth,12 Feb. 2017,9.1,John Oliver talks about Donald Trump's activities since becoming the President.
4,2,Putin,19 Feb. 2017,8.6,John Oliver talks more about the President Trump's activities specially his statements about having a nicer relationship with Russia. He also talks about Russian President Putin.
4,3,Obamacare Replacement,26 Feb. 2017,8.2,"John Oliver continues to talk about ventures of US President's office. He also talks about the pros and cons of Obamacare, and the upcoming Obamacare replacement plan."
4,4,Dalai Lama,5 Mar. 2017,8.7,"John Oliver talks about President Trump, Jeff Sessions and Tibet. He also conducts an interview of Dalai Lama."
4,5,American Health Care Act,12 Mar. 2017,8.2,John Oliver talks about American Health Care Act in detail. He also talks about International Women's Day and CIA Wikileaks.
4,6,Federal Budget,19 Mar. 2017,8.3,The main story looks at the Trump White House's proposal for the next US budget. Oliver ends with a look at Bolivia's uses of youths costumed as zebras to make crosswalks safer and more fun.
4,7,Cannabis in the United States,2 Apr. 2017,8.2,"Under federal law, even legal marijuana is illegal. John Oliver explains why conflicting drug laws pose serious problems."
4,8,Gerrymandering,9 Apr. 2017,8.2,"John discusses Trump's military response in Syria, Bill O' Reilly's harassment claims and the issue of Gerrymandering."
4,9,French Elections,16 Apr. 2017,8.6,The presidential election in France could determine the political future of Europe. John Oliver visits an excessively French bistro to deliver an urgent message to voters.
4,10,Ivanka & Jared,23 Apr. 2017,8.5,Ivanka Trump and Jared Kushner hold an incredible amount of political power. That's troubling considering their incredibly small amount of political experience.
4,11,Net Neutrality 2,7 May 2017,8.6,John Oliver points out that Net neutrality is under serious threat again and that all concerned should raise their concern to the respective authorities at all platforms.
4,12,Dialysis,14 May 2017,8.0,John Oliver highlights the opportunities for improvement of the for-profit dialysis industry.
4,13,Stupid Watergate,21 May 2017,8.6,Stupid Watergate is a reference to Nixon presidency's scandals which led him to resign and Oliver contrasts it with current series of scandals of Trump and how they've led to talks of impeachment just within 4 months of his presidency.
4,14,Paris Agreement,4 Jun. 2017,8.3,The U.S. pull out from the Paris agreement. Plus the London terror attacks and this week in Putin.
4,15,Brexit II,11 Jun. 2017,8.6,"In the wake of a divisive election, the UK will begin the process of leaving the European Union. John Oliver and an intergalactic space lord propose a plan."
4,16,Coal,18 Jun. 2017,8.5,Donald Trump won coal country in the 2016 election in part by promising to do away with Obama era job killing regulations. But what is it that's really killing coal jobs and where is the most promising growth in the region.
4,17,Vaccines,25 Jun. 2017,8.4,John discusses people that are afraid to vaccinate their children out of fear.
4,18,Sinclair Broadcast Group,2 Jul. 2017,8.4,"John Oliver takes on The Sinclair Broadcast Group, detainer of the majority of local news channel. He also tackles past president's of the United States with a focus on Warren G. Harding, and POTUS Donald Trump"
4,19,Alex Jones,30 Jul. 2017,8.5,"In response to Alex Jones' claims that the media cherry picks negatives from his ""Info Wars"" program, Oliver devotes a full show to Jones' popular right wing rant show."
4,20,Border Patrol,6 Aug. 2017,8.0,Oliver warns that Donald Trump's desire to have a surge in border patrol agent numbers was also tried by G.W. Bush's White House with disastrous results in the quality of agents added to the force.
4,21,North Korea,13 Aug. 2017,8.5,Oliver does his best to work out the thinking behind Kim Jong Un's continued push to make his nation a nuclear power regardless of the on going cost to his people.
4,22,Nuclear Waste,20 Aug. 2017,7.9,"John Oliver discusses both the imminent and long-term dangers of nuclear waste deposits in the United States, and the unresolved need for governmental solutions to a now decades old problem."
4,23,Presidential Pardons,10 Sep. 2017,7.9,"John Oliver talks about presidential pardons, and specifically President Trumps first pardon of Joe Arpaio. He discusses the crimes Arpaio is convicted for, and the message Trumps sends by pardoning him."
4,24,Corporate Consolidation,24 Sep. 2017,8.1,"John Oliver talks about Corporate Consolidation and Anti-Trust laws, Megyn Kelly's new daytime talk show, Donald Trump vs. Black Athletes, Tim Price and Steve Mnuchin's plane scandals and the fate of the Scranton Train."
4,25,Forensic Science,1 Oct. 2017,7.9,"John Oliver talks President Trump's inability to organize Puerto Rican disaster relief, the proposed Republican tax reform, and the shortcomings of forensic science - offering a glimpse at how CSI shows might be made more realistic."
4,26,Confederacy,8 Oct. 2017,8.4,[HBO] HD. Main story: Confederate symbols are still celebrated despite the ugly history they symbolize.
4,27,Equifax Security Breach,15 Oct. 2017,7.8,"[HBO] HD. Main story: Equifax; plus, Harvey Weinstein scandal; Trump's latest strikes at Obamacare and the Iran nuclear deal."
4,28,National Flood Insurance Program,29 Oct. 2017,7.8,"[HBO] HD. Main story: Floods; plus, opioid epidemic; Alabama Senate Republican candidate Roy Moore; Australian vote on legalizing same-sex marriage."
4,29,Economic Development Incentives,5 Nov. 2017,7.9,"[HBO] HD. Main story: Economic development; plus, the latest on ""Stupid Watergate;"" And Now: Morning Shows Celebrating Halloween; the USPS on TV."
4,30,Presidency of Donald Trump,12 Nov. 2017,8.7,John Oliver recaps the first year of the Trump presidency and gives a warning about the three techniques he uses to undercut criticisms without addressing the related issues.
5,1,Trump vs. The World,18 Feb. 2018,8.4,John Oliver depicts how the world see America now in the era of Trump presidency. America's image is being compromised by its very own president. Not only comedians but also the world leaders are making fun of him and distancing themselves from America. Americas control over soft power is decreasing because of the vacancies in key diplomatic positions.
5,2,Italian Election,25 Feb. 2018,8.3,"[HBO] HD. Main story: Italian election; plus, Trump's idea to arm teachers; Canadian PM Justin Trudeau and Donald Trump Jr. in India."
5,3,NRA TV,4 Mar. 2018,8.2,"The NRA's streaming lifestyle network aims to boost gun sales, often by using an ominous tone that would make just about anything sound terrifying... including muffins."
5,4,Cryptocurrencies,11 Mar. 2018,7.9,"Tonight's main topic is 'Cryptocurrencies'. These digital currencies are creating a lot of noise nowadays. John Oliver explains the volatility of the concept, along with its perks and suggests everyone to gamble on Cryptocurrencies in a very cautious manner."
5,5,Mike Pence,18 Mar. 2018,8.5,[HBO] HD. Main story: John Oliver creates his own children's book about a bunny to compete with Mike Pence's .
5,6,Immigration Courts,1 Apr. 2018,8.1,"In this episode, John Oliver covers Immigration Court."
5,7,Crisis Pregnancy Centers,8 Apr. 2018,7.9,Crisis pregnancy center is an institute which talks women away from abortion by any means possible. They can practically state wrong information and misleading data to confuse women. Which is more shocking is that they are not breaking any law with these wrong advises. Moreover it is quite easy to open a crisis pregnancy center. And John Oliver did that from New York. Behold the 'Vanned Parenthood'.
5,8,Corporate Taxes,15 Apr. 2018,8.1,John Oliver talks about the Corporate Taxes. He gives examples of how big corporation always tries to evade taxes. They are using the loop holes in American tax system. He also expressed his doubts about the promises were made by the new tax plan. He used the unfruitful past experience of tax holiday to support his claim.
5,9,Iran Deal,22 Apr. 2018,8.1,"'Iran Deal' is the worst deal of all time in Donald Trump's Eyes. But John Oliver Explains Why It Is Better Than No Deal. Because this deal strictly forbade Iran to develop any sort of nuclear weapons. And all of their declared nuclear sites have close monitoring, as well as any suspected site could be monitored within 24 days of the request. The sad part is, top advisers of Trump administration are also against the deal. That is why John prepared a new ad with catheter cowboy to explain the matter to Trump and scheduled it on his favorite Sean Hannity's show."
5,10,Rudy Giuliani,6 May 2018,8.8,"Rudy Giuliani is the newest addition to the Trump's lawyers. He revealed some pretty damaging stuff about the Stormy Daniels story, which contradicts his employer's statement. But it is not a new thing for Rudy Giuliani because he was doing it throughout his career and was always eager to appear in television or limelight even if it is the lamest way possible."
5,11,Venezuela,13 May 2018,7.7,"Venezuela is in deep economic crisis. People in Venezuela are suffering immensely for the epic management from Nicolás Maduro's government. That is why people are now taking desperate measures like violent protests, food riots etc. Despite the extreme conditions Maduro failed to content the situation, instead he made the inflation unbearable. As well as Maduro changed Venezuela's democratic process to stay in power and eventually dominated the election where there was virtually no actual opponents."
5,12,Rehab,20 May 2018,8.0,Rehab is a billion dollar industry of USA. But this enormous addiction treatment industry is not regulated enough. That is why they can claim a high success rate of their facility without any hard evidence. Not only that they have a practice of using urine of addicts to make money. Which is known as the liquid gold in recovery industry.
5,13,Guardianship,3 Jun. 2018,8.1,"John Oliver discusses a surprising letter from Kim Jong-un to President Trump, journalist Arkady Babchenko's rising from the grave, a British royal expert born an Italian American, and the fraught issue of senior citizen guardianship."
