temporada,numero,titulo,fecha_estreno,puntuacion,descripcion
5,14,Stupid Watergate II,10 Jun. 2018,8.0,"This was the second installment 'Stupid Watergate'. As it is not possible to indict a sitting president according the law the only way left is the impeachment and Trump knows that very well. So his team and allies are trying to undermine the Muller Investigation by denying facts, spreading lies and creating baseless conspiracy theories. Because if the public have enough doubts in their mind about any wrongdoings by Trump administration, Trump will not be impeached as public opinion matters a lot in this matter. Therefore Trump will remain immune to any possible ..."
5,15,Xi Jinping,17 Jun. 2018,8.1,"Chinese president Xi Jinping is putting China into the world map. Previously China had a lay low international strategy which is known as 'hide your strength and bide your time'. But Xi Jinping is choosing a different path, he wants to let the world to know more about china and vice versa. And he is extremely popular among Chinese people because of their lasting economical growth and crackdown of corrupt government officials. As his influence is growing in the world with massive economy and infrastructure plans there is a growing concern also, as he is becoming more ..."
5,16,Mexican Elections,24 Jun. 2018,7.8,"Biggest Mexican election in history is underway. In present times, the sitting president Enrique Peña Nieto is hugely disliked by the Mexican mango people for the vast corruption of his administration. There is even a 'Corrupt Tour' where visitors and tourists can learn about the places and city landmarks where allegedly corruptions with public money occurred. As Mexico has one term rule for presidents so Mexico will replace him soon with one of these potential candidates: Andrés Manuel López Obrador or Ricardo Anaya Cortés. John Oliver then explains these candidates ..."
5,17,Gene Editing,1 Jul. 2018,7.7,"'Gene Editing' is a very fascinating field. It has enormous potential to improve the human life. While many scientists are extremely cautious about their experiments, there are also some who handles the matters about gene editing quite lightly. John Oliver explains the different risks, possible rewards of gene editing."
5,18,Workplace Sexual Harassment,29 Jul. 2018,7.8,"After tackling ""Stupid Watergate,"" Oliver talks about the subject of workplace sexual harassment and hosts a special interview."
5,19,Prosecutors,5 Aug. 2018,8.0,"John Oliver talks about an important but less known element of America's criminal justice system: 'Prosecutors'. Prosecutors held an powerful influence over cases but have not much accountability about their decisions. As nearly 95 percent of the cases that prosecutors decide to prosecute end up with the defendant pleading guilty without going to trial, prosecutors can easily misuse their power by withholding important evidences which might led to wrongful convictions."
5,20,Astroturfing,12 Aug. 2018,7.8,"After discussing racists, John talks about astroturfing."
5,21,Trade,19 Aug. 2018,8.3,[HBO] HD. Main story: Donald Trump is waging a trade war that hurts a lot of American workers.
5,22,Felony Disenfranchisement,9 Sep. 2018,8.0,Felony Disenfranchisement is what Jon Oliver talks about. Many people who had felony convictions are unfairly restricted from voting rights even long after of serving his/her conviction. And there is no clear instruction or process to regain the voting status. People have to rely on the whims of a clemency board which is absurd.
5,23,Facebook,23 Sep. 2018,8.2,"After commenting the recent allegation of sexual misconduct against Supreme Court nominee Brett Kavanaugh, John Oliver looks at the troubling impact Facebook is making internationally, such as on the Rohingya crisis in Myanmar."
5,24,Kavanaugh,30 Sep. 2018,8.4,"John Oliver discusses the ongoing controversy surrounding Brett Kavanaugh, the sexual assault allegations against him, his Supreme Court nomination, and what that could all mean for the highest (mostly-dog) court in the land."
5,25,Brazilian Elections,7 Oct. 2018,8.1,"Brazil is going to have its 2018 Brazilian general election. John Oliver introduces the candidates who might have the chance to win the election. He then talks about the growing unrest regarding this election among general people as all the candidates are worse than each other. Among all the candidates Bolsonaro is the worst and he is also compared as the Brazilan Trump. Sadly he is doing well in the election, that is why a new movement emerged opposing him which is called #EleNao (#NotHim). Finally John Oliver requested all Brazilian to save themselves by voting ..."
5,26,Saudi Arabia,14 Oct. 2018,8.1,"Saudi Arabia, despite their numerous human right violations is a long standing close ally of United States of America. John Oliver states the reasons behind the unconventional camaraderie between these two nations. Past few presidents of America also turned a blind eye to all the wrongdoings of Saudi Arabia.Then he talks about how Trump is boosting the confidence of autocratic Saudi regime more than ever by showing unconditional support because of the billion dollar business promises. Renowned journalist Jamal Khashoggi, a critic of Saudi royal family might be the ..."
5,27,State Attorneys General,28 Oct. 2018,7.6,"John Oliver briefly catches up with last week's events: deadliest attack on Synagogue, Saudi's lamest explanation of Jamal Khashoggi murder. Then he talks about the State Attorneys General. He explains the importance of role and contribution State AGs. State AGs are very powerful as they sue the federal government. So the races to elect these influential peoples are worth voters' attention."
5,28,Family Separation,4 Nov. 2018,8.3,John Oliver gives a quick recap about the USA's midterm election activities. Then he talks about the main story of the night: Family Separation. He discussed the absurdity of the policy and the toll it takes on the families of the immigrants. He also stated his sincere concern about the fact that it could very possibly happen again.
5,29,Drain the Swamp,11 Nov. 2018,7.9,"Firstly, John Oliver addresses the firing/resignation of Attorney General of the United States Jeff Sessions and his successor. Then he starts talking about the catch phrase Trump used in his campaign 'Drain the swamp'. John illustrates that how little Trump had done to drain the swamp, rather he is nurturing him and appointing them in key positions to make favorable decisions for the lobbyists. Finally he closes with the fact how celebrities earning millions of dollars by promoting products in social media without proper declaration of an ad post."
5,30,Authoritarianism,18 Nov. 2018,8.6,"[HBO] HD. Main story: A look at the growing number of authoritarian leaders around the world. Plus, the fate of Russell Crowe's jockstrap."
6,1,Brexit,17 Feb. 2019,8.4,"The UK could officially leave the European Union next month, which would be a huge change with hugely damaging consequences."
6,2,Psychics,24 Feb. 2019,8.0,"Psychics is something fun to talk about. But John Oliver talks about the alarming fact that 4 out of 10 believe in psychics (according to a research). And it is alarming that they swindle money out of desperate peoples. Additionally they often put people through severe emotional trauma about their loved ones. As John explains them in the show, these psychics use two simple tactics to do that: cold reading and hot reading."
6,3,Automation,3 Mar. 2019,8.0,Automation is a complicated blessing. It makes our life easier by creating safe and more productive environment but it also eliminates job opportunities. Rather than dealing with the issue tactfully President Trump is doing what he likes the most- 'Blaming Others'. John explains that even automation kills job but jobs are being created in new sectors. He suggests some ways to transition into these new sectors and initiatives need to be taken to accommodate older workers in the changing job sector.
6,4,Robocalls,10 Mar. 2019,8.3,Robocalls are one of the most annoying thing of having a cellphone. Over the recent years these robocalls are increased exponentially because of the advancement of the technology. There needs to be some sort effective policies to regulate these robocalls. If only Federal Communications Commission (FCC) cared a little more about this issue. So John take it upon his shoulder to give them the medicine of robocalls in small doses (after every 90 minutes).
6,5,Public Shaming,17 Mar. 2019,8.4,"John covers the New Zealand terrorist attack, and does a long piece on the effects of Public Shaming."
6,6,WWE,31 Mar. 2019,8.2,"In this weeks 'Last Week Tonight', the Mueller report is finally released, David Bernhardt has a surprise guest at his confirmation hearing, and John does a deep-dive into the WWE world wrestling entertainment."
6,7,Mobile Homes,7 Apr. 2019,7.9,"This week, Trump lies, why Stephen Moore and Herman Cain are terrible picks for the federal reserve, Baltimore's mayor embroiled in scandal, the secret star of TV divorce courts, and a deep dive into the hidden disasters of mobile homes."
6,8,Opioids II,14 Apr. 2019,8.3,John Oliver opens with a quick update about the infamous BREXIT. Then he talks about the news of arresting Julian Assange and how the media is focusing on his looks. After that he provides the recent updates about the opioid crisis and revealing the big players of this crisis.
6,9,Mueller Report/Chiitan,21 Apr. 2019,7.7,John covers the latest on the Mueller Report and presents the loving saga of his anime alter ego making friends with Japanese local mascot Chiitan.
6,10,Lethal Injection,5 May 2019,8.2,"John covers one Dem's silly KFC response to William Barr's refusal to testify before Congress, Aussie politicians' scandals, the best TV ad for a lawyer ever, the cutest frog ever, and the main topic - why the lethal injection is inhuman."
6,11,Green New Deal,12 May 2019,8.2,"John discusses Putin's fall during a hockey game, the GOP states passing extreme anti-abortion laws, the Republican backlash against Alexandria Ocasio-Cortez's Green New Deal, and Bill Nye the Science Guy's gritty take on climate change."
6,12,Death Investigations,19 May 2019,7.9,"[HBO] HD. Main story: America's system for conducting death investigations is a mess; plus, a look at the Eurovision Song Contest."
6,13,Medical Devices,2 Jun. 2019,7.8,"John tackles the US multi-billion dollar medical device industry, which lacks proper monitoring and necessary regulations. He also explains the huge difference between the terms 'FDA approved' and 'FDA cleared,' and points out the loopholes and corruption through lobbying the companies in the industry use to bypass the government's flawed and dated oversight system."
6,14,Equal Rights Amendment,9 Jun. 2019,8.1,"[HBO] HD. Main story: A look at the Equal Rights Amendment; plus, candidates vying to be the UK's next prime minister."
6,15,Impeachment,16 Jun. 2019,8.1,"John is delighted by the many salacious layers of Rep. Duncan Hunter's (R-CA) huge corruption scandal. Also, since Trump-related scandals pop up every week, the voices calling for his impeachment are getting louder than ever. John explains the facts behind the impeachment process and in what ways it might effect the Trump presidency. Even though it has many risks, John suggests that it might be a good idea to uphold one of America's core values that 'no one is above the law'."
6,16,Everest,23 Jun. 2019,7.9,"[HBO] HD. Main story: Climbing Mount Everest has become dangerously popular; plus, Trump almost goes to war with Iran."
6,17,Warehouses,30 Jun. 2019,8.1,"Main story: The often brutal exploitation of workers in giant warehouses used or operated by e-commerce businesses and corporations like Amazon ; plus, Jared Kushner's Middle East peace plan."
6,18,Boris Johnson,28 Jul. 2019,8.3,"In the wake of Theresa May's resignation, Boris Johnson becomes Britain's new prime minister. John explains how Johnson came so far, how he is both the same as and different from Trump, and what, if any, strategy he has to succeed as PM despite his foolish nature, racist views, history of spreading false information, and frequent offensive remarks. Also, the controversial governor of Puerto Rico resigns after mass street protests."
6,19,Prison Labor,4 Aug. 2019,7.8,"Prison labor is more like free labor since many people believe that prisoners should not be paid for their work. John explains how little convicts make and what ridiculous ways the private prisons and the local government come up with to make them spend it the way they want, and how some selfish companies are now even profiting off of prisoners' innocent families. Also, John covers the horrific shootings at Dayton, Ohio and El Paso, Texas, UK PM Boris Johnson's bad week, and Trump's baffling Director of National Intelligence pick, John Ratcliffe, and what that says ..."
6,20,Burdihamedov/Guinness World Records,11 Aug. 2019,8.5,"The president of Turkmenistan, Gurbanguly Berdimuhamedov, is a highly eccentric autocratic ruler of a country that's competing for the bottom position in freedom of speech and human rights indicators. John covers Berdimuhamedov's bizarre obsession with setting silly new Guinness World Records, presenting himself as a superman, and loving his horses to an obsessive and uncomfortable degree. John also exposes the Guinness World Records company's disturbing affair with world dictators, and tries to set his own Guinness World Record. Also, Trump's latest blunders, and the..."
6,21,Bias in Medicine,18 Aug. 2019,7.8,"Bias in medicine still exists in the U.S. and it's really affecting the life of a huge number of people every year who are seeking medical attention. With the help of comedians Larry David and Wanda Sykes, who inspired the piece, John discusses the adverse effects that the doctors' gender and racial biases can have when treating patients who aren't white men. Also, Trump wants to buy Greenland, China uses Orwellian propaganda against Honk Kong's pro-democracy protesters, and Halloween Pumpkin Spice Latte returns super early this year."
6,22,Filibuster,8 Sep. 2019,7.8,"In theory, the filibuster was created to ensure bipartisanship in the US Senate. In practice, it has become a way to kill bills with only 41 Senate votes. John explains the strange origin of the filibuster, how its overuse made the Senate a place where even bipartisan bills go to die, and why filibustering should be abolished altogether. Also, Trump's Hurricane Dorian Sharpie Scandal, the UK PM Johnson's clash with the Parliament over his No-deal Brexit strategy, and Fox News' Stu Varney fanboys over Trump."
6,23,Legal Immigration,15 Sep. 2019,8.2,"John explains how legal immigration to the U.S. actually works (family, employment, Diversity Visa Lottery, and refugee status), why Trump's propaganda against it is absurd, how his administration is trying to severely limit it and how their efforts actually increase illegal immigration. Also, Moscow's non-democratic local elections, pro-Putin Russian rappers, Maria Bartiromo's awkward birthday, and Lt. Joe Kenda's true crime show."
6,24,Compounding Pharmacies,29 Sep. 2019,7.9,"Compounding pharmacy is a special kind of pharmacy which creates specific medication tailored to the specific needs of individual patients, both human and animal. These medicines are not commercially made which means that the FDA has no jurisdiction to monitor these pharmacies. This lack of oversight leaves plenty of room for corruption and fraud which directly leads to overpricing, patients not getting the treatment they need or, in severe cases, developing serious health issues and dying. Also, Trump's Ukraine scandal leads to Impeachment inquiry."
6,25,China's One Child Policy,6 Oct. 2019,7.9,"John explains the troubling history, brutal enforcement and questionable results of China's highly controversial, decades long, one-child policy, a punitive measure conceived originally as the simplest way to handle overpopulation. But, this was done without thinking through the long term consequences so China now has 34 million more men than women and both grandparents and parents have to rely on a single child to support them all. That is why the old two-child policy was recently reintroduced in an equally simplified and unfair approach to a complex problem. Also, ..."
6,26,National Weather Service,13 Oct. 2019,7.9,"Predicting the weather correctly is very important as it saves lives and protects resources. Despite their enormous efforts, the National Weather Service (NWS) gets very little credit for their hard work even though private companies like AccuWeather make tremendous profit using their data. John explains the importance of the NWS, why AccuWeather wants to take control of it with Trump's help and why that's a very dangerous idea. Also, Stupid Watergate II continues with the arrest of Rudy Giuliani's Ukrainian associates, and John's show says goodbye to Fox News host ..."
6,27,Trump & Syria,27 Oct. 2019,8.2,"Middle East was and still is a place with multi-level problems, so it is always quite tough to make a policy which will satisfy everyone's interests. But it's even tougher to screw things up in the way Trump did with Turkey and Syria. John explains how Trump's abrupt decision to hastily pull U.S. troops out of Syria seriously hurt America's interests, reputation and allies in the region while also propping up America's rivals and enemies. Also, Brexit is still a thing, the leader of I.S.I.S. is killed, TV anchors love quoting N.A.S.A. when things go wrong, and the ..."
6,28,Voting Machines,3 Nov. 2019,8.1,John gives a brief update on 'Stupid Watergate II' and then dives into the main topic - the trouble with voting machines.
6,29,SLAPP Suits,10 Nov. 2019,9.6,"After winning a legal battle over his episode Last Week Tonight with John Oliver: Coal (2017) involving a Trump-allied coal executive and John's giant squirrel, John Oliver explains how 'SLAPP suits' like this one are designed to stifle public dissent."
6,30,Census,17 Nov. 2019,8.1,"John explains why everyone's participation in the 2020 U.S. Census is of crucial importance for the country and how the Trump administration is trying to influence its results in their favor. Also, Chiitan and Chiijohn make their return."
7,1,Medicare for All,16 Feb. 2020,8.2,"[HBO] HD. Main story: The pros and cons of Medicare for All; plus, Bill Barr does Trump's personal bidding; and Flyers mascot Gritty is exonerated!"
7,2,Modi,23 Feb. 2020,8.3,"[HBO] HD. Main story: John Oliver talks about India's controversial Prime Minister, Narendra Modi; plus, Mike Bloomberg's presidential campaign."
7,3,Coronavirus,1 Mar. 2020,8.5,"John covers the Covid-19 pandemic, how each country, including the US, is handling it, and why the Phillie Phanatic is in a copyright row. Also, Tom Steyer quits the Democratic presidential race, and Chris Matthews messes up his sign offs."
7,4,Sheriffs,8 Mar. 2020,8.0,"[HBO] HD. Main story: A look at how much power-and how little accountability-local sheriffs have; plus, Trump's coronavirus incompetence."
7,5,Coronavirus II,15 Mar. 2020,8.6,"[HBO] HD. John Oliver discusses how the government is handling the coronavirus outbreak, how they're not, and what we can do to help."
7,6,Coronavirus III,29 Mar. 2020,8.4,"In the first show from his makeshift home studio, John covers the horrible way COVID-19 pandemic is going and how Trump is mishandling it, how TV hosts are practicing social distancing, and how profoundly gleeful 90s erotic rat art can be."
7,7,One America News Network,5 Apr. 2020,8.2,"John criticizes the Republican governors' response to the pandemic, showcases how everyone filming from home gets asked if they're wearing pants, and warns of the new ultra right wing, extremely pro-Trump network called OAN(N)."
7,8,Coronavirus IV,12 Apr. 2020,8.2,"John explains how the Trump administration failed to protect the unemployed, small businesses and essential workers during the pandemic, the peeps make their unholy return, and 90s rat erotica makes John's day once again."
7,9,Coronavirus V,19 Apr. 2020,8.0,"John analyzes the right wing media's protests, conspiracy theories and misinformation spreading about the pandemic, spotlights Inside Edition's latest 'coming up' segments, and becomes a fan of the home edition of The Wendy Williams Show."
7,10,Coronavirus VI: Testing,3 May 2020,7.7,"John points out the failure of The FDA and federal government when experts encourage widespread coronavirus testing for several months. The number of tests being done everyday far behind the lowest recommended number. John talks about the different types of tests: diagnostic and antibody tests, and how the tests work."
7,11,United States Postal Service,10 May 2020,7.6,John discusses the United States Postal Service which is in dire need of economic assistance from the government. He examines some of the essential services of the USPS and why it is facing such financial trouble due to a 2006 law requiring it to pre-pay health care benefits on a fifty year schedule while at the same time putting price caps on services and products.
7,12,Coronavirus VII: Sports,17 May 2020,7.7,"John discusses the sudden disappearance of sports due to coronavirus, how their absence is impacting people emotionally and financially, and the complications of bringing them back anytime soon."
7,13,Voting by Mail,31 May 2020,7.8,"John explains the importance of voting by mail. Also, mass protests against police brutality erupt in Minneapolis, TV hosts inquire about the odd objects behind their stay-at-home guests, and John schools UFC president Dana White."
7,14,Police,7 Jun. 2020,8.8,This episode tackles the hard truth about the history of Police in the United States and the many problems that are faced in fixing those problems.
7,15,Facial Recognition,14 Jun. 2020,7.8,Facial recognition is no longer an issue of a thriller movie. It has become a part of our life. John Oliver talks about various aspects and global practice of facial recognition technology. He explains how dangerous it could be by addressing the questionable activities of facial recognition company Clearview AI.
7,16,Coronavirus VIII: Prisons & Jails,21 Jun. 2020,7.3,"In the latest episode on coronavirus John talks about US prisons and jails. These confined spaces have frightening number of COVID-19 infections. And there has been insufficient initiatives to address the matter. Consequently, in some cases inmates are taking matters in their own hand to raise concern about situation behind bars."
7,17,Coronavirus IX: Evictions,28 Jun. 2020,7.6,"Like coronavirus and unemployment issues evictions is something that USA could prepared for. While people are choosing between rent and food due to the pandemic, John Oliver presented the flaws of current system and flawed solution. He urges federal government to come with a proper solution for the affected soon. Also, some people refuse to wear masks, and Papa John embraces TikTok."
7,18,Conspiracy Theories,19 Jul. 2020,8.0,Conspiracy theories are the hotcakes of the internet. John talks about why people like these conspiracy theories and why in the age of internet it spreads so quickly. He also explains the detrimental effect can have on people's life. Finally celebrities urges people to be more vigilant and inquisitive about these theories as majority of these theories are baseless and created to create unrest among people.
7,19,Uighurs,26 Jul. 2020,8.2,"Minorities often get oppressed throughout the world. But John shed a light on the matter of the systematic oppression that the Uighur people are facing at the hands of the Chinese government. Lack of pressure and public awareness aiding the Chinese government to get away with the heinous human rights abuses. John also urges United Nations, developed countries and as well as big corporations to pursue the Chinese government to abandon such inhumane practices Uighur people."
7,20,U.S. History,2 Aug. 2020,8.4,"John Oliver talks about the flawed way children learn about the history of race in USA. He points out the three major points needed to address about the white supremacy and racial injustice throughout the history. He emphasized that teaching them complete history rather than the misleading information is good way to move forward to the path of prosperity. Without that reform, the gap between minorities and whites will continue to extend, as well as the misconception of white supremacy will prevail in the society."
7,21,Juries,16 Aug. 2020,7.5,"John Oliver takes a look at why people of color are routinely excluded from becoming jurors, who their absence impacts, and what we can do to create a fairer system."
7,22,Border Wall,23 Aug. 2020,7.8,"John Oliver delivers the second installment on one of the key promises of President Trump's campaign: the border wall. Where he gave updates about the wall situation, who is funding it and why it is still absurd initiative. He also talks about the alleged frauds about the fundraising for the wall and the favoritism toward a particular company bagging wall construction deal despite their sketchy past."
7,23,RNC 2020 & Kenosha,30 Aug. 2020,8.3,"John Oliver talks about multiple pressing issues. He explains the fear mongering tactics of RNC and their flawed logic, as well as misrepresentation of the truth. He also talks about the horrible incidents took place in Kenosha, how police two citizens in different way solely based on the skin color. Finally he closes with a fun piece about Danbury."
