temporada,numero,titulo,fecha_estreno,puntuacion,descripcion
1,1,One Planet,5 Apr. 2019,9.1,Witness the planet's breathtaking diversity -- from seabirds carpet-bombing the ocean to wildebeests eluding the wild dogs of the Serengeti.
1,2,Frozen Worlds,5 Apr. 2019,9.2,"On the unforgiving frontier of climate change, polar bears, walruses, seals and penguins find their icy Edens in peril."
1,3,Jungles,5 Apr. 2019,9.1,"Jungles and rainforests are home to an incredible variety of species like preening birds, intelligent orangutans and remarkably ambitious ants."
1,4,Coastal Seas,5 Apr. 2019,8.9,"From fearsome sharks to lowly urchins, 90 percent of marine creatures live in coastal waters. Protecting these habitats is a battle humanity must win."
1,5,From Deserts to Grasslands,5 Apr. 2019,8.8,"Cameras follow desert elephants seeking sustenance, bison roaming North American grasslands and caterpillars living the good life underground."
1,6,The High Seas,5 Apr. 2019,9.0,"Venture into the deep, dark and desolate oceans that are home to an abundance of beautiful - and downright strange - creatures."
1,7,Fresh Water,5 Apr. 2019,8.9,"The need for fresh water is as strong as ever. However, the supply is becoming increasingly unpredictable for all manner of species."
1,8,Forests,5 Apr. 2019,9.1,"Examine the fragile interdependence that exists between forests' wide variety of residents, including bald eagles, hunting dogs and Siberian tigers."
