temporada,numero,titulo,fecha_estreno,puntuacion,descripcion
1,1,Episode #1.1,24 Sep. 1995,8.4,"Two rich, eligible and handsome young bachelors gallop into Hertfordshire and the lives of every hopeful young maiden and her ambitious mother in the neighborhood. Mr Bingley has bought Netherfield Park and has brought his sisters and friend, Mr Darcy, with him. To Mrs Bennet at Longbourn House, they are the answer to her prayers. She has five daughters to marry, and their dowries are not large."
1,2,Episode #1.2,1 Oct. 1995,8.4,"The Bennets are expecting a visitor - Mr Bennet's clergyman cousin, who will inherit the estate in the absence of any direct male heirs. Mr Collins is coming to Longbourn with the intention of healing the rift between his branch of the family and the Bennets. Though Mrs Bennet cannot help thinking he has come to check over the place, he arrives with the best of intentions."
1,3,Episode #1.3,8 Oct. 1995,8.6,"Less than three days after Mr Collins' proposal to her, Elizabeth is shocked to discover that he has been accepted by her best friend, Charlotte Lucas. Elizabeth cannot believe Charlotte can demean herself so, but her friend tells her that she cannot afford to be choosy and Mr Collins is a good catch. The marriage is to be soon, but Charlotte begs her to visit them at Hunsford Parsonage in March."
1,4,Episode #1.4,15 Oct. 1995,8.7,"Angry and upset over his rejection, Darcy decides to defend himself. He waylays her on her morning walk, hands her a letter and leaves. The contents leave Elizabeth reeling. Darcy indeed had good cause for his behavior towards Wickham, but Elizabeth can only shake her head in sorrow and disagreement as she reads that, when he separated Bingley from Jane, he believed her to be indifferent to him."
1,5,Episode #1.5,22 Oct. 1995,8.7,"The following day, the Bingleys and Georgiana (Darcy's sister) arrive at Pemberley. Soon after, they call upon Elizabeth, who is staying nearby at the inn in Lambton. The visit is a success: Elizabeth immediately warms to Georgiana and Mr Bingley is clearly delighted to see Elizabeth again."
1,6,Episode #1.6,29 Oct. 1995,8.8,"After Lydia is married, she and Wickham come to Longbourn for a visit before joining Wickham's new regiment in the North. She is as silly as ever and very proud of her success in catching Wickham, even offering to get husbands for her sisters. But she accidentally lets slip that Darcy was at her wedding. Elizabeth writes to Mrs Gardiner for an explanation."
