temporada,numero,titulo,fecha_estreno,puntuacion,descripcion
9,1,Biscuit Week,28 Aug. 2018,7.6,"The bakers tackle signature biscuits that will say something both about them and a place in the British Isles. Next the bakers face their first Technical, and hiding under the gingham cloth is one of Paul's childhood favourites - an iconic biscuit that's sure to send the bakers round in circles. Finally, it's crunch time. The bakers will have to be picture perfect with their first showstopper - a spectacular 3D biscuit portrait challenge that requires precision baking and superb decorating skills. Three challenges, three chances to win star baker, three chances to ..."
9,2,Cake Week,4 Sep. 2018,8.0,"The 11 remaining bakers face a tough test in Cake Week, including a crowd-pleasing signature challenge, Prue's first technical challenge, and a chocolate collared showstopper."
9,3,Bread Week,11 Sep. 2018,7.8,"It's Bread Week, and the ten remaining bakers have a lot to prove with three tough challenges set by judges Paul Hollywood and Prue Leith. There is a teatime fruity favourite Signature; a deceptively simple time-test of a Technical with an international flavour; and an ambitious Showstopper that's the largest bread sculpture challenge ever set in the tent. Only one can claim Star Baker, while one of them will leave the tent for good."
9,4,Dessert Week,18 Sep. 2018,7.8,"The bakers must create a cracking meringue Signature, a wobbly Technical, and a complex chocolate Showstopper that promises to reveal all."
9,5,Spice Week,25 Sep. 2018,7.7,Paul and Prue set the bakers a classic teatime Signature. There's also an Arabian Technical and a fiddly Showstopper.
9,6,Pastry Week,2 Oct. 2018,7.9,"It is Pastry Week, and Paul and Prue are looking perfection - with savoury and sweet samosas, a classic French technical, and for the final challenge, a daunting majesticpie fit for a banquet."
9,7,Vegan Week,9 Oct. 2018,7.5,"For the very first time on Bake Off, it's Vegan week. Prue and Paul have set three very different challenges to test the remaining bakers. A savoury pastry Signature, with no butter involved. A cracking Technical, with a very unusual ingredient. And finally, a spectacular Showstopper that, in the heat of the tent, threatens to lead to catastrophe. Who will keep their cool and win star baker? And who will be meeting their end?"
9,8,Danish Week,16 Oct. 2018,7.5,"Velkommen to Danish Week in the latest episode of The Great British Bake Off. The bakers face unfamiliar recipes as they battle to impress Prue Leith and Paul Hollywood. There's a bread challenge Signature where they must demonstrate style as well substance. Paul sets a spherical Technical - and with a place in the Bake Off Semi-final at stake, everyone is out to impress. And for their final challenge, the bakers must deliver an elaborate pastry Showstopper fit for a Danish birthday party. Who will become an honorary Great Dane, and who will be leaving the tent?"
9,9,Semi-Final: Patisserie Week,23 Oct. 2018,7.9,The remaining bakers are just three patisserie challenges away from the final.
9,10,Final,30 Oct. 2018,7.3,Paul and Prue set three final challenges in the Bake Off Final.
9,11,The Great Christmas Bake Off,25 Dec. 2018,7.8,
9,12,The Great Festive Bake Off,1 Jan. 2019,7.6,
10,1,Cake Week,27 Aug. 2019,7.8,"It's Cake Week and a fresh batch of bakers enter the tent to take on a fruit cake Signature, a retro Technical, and a childhood Showstopper."
10,2,Biscuit Week,3 Sep. 2019,8.0,Jo Brand welcomes new host Sandy Toksvig along with Jamie Laing and Sarah Millican.
10,3,Bread Week,10 Sep. 2019,8.1,The bakers tackle a signature bake designed to be shared; a deceptively simple summer staple in the Technical; and an ambitious Showstopper.
10,4,Dairy Week,17 Sep. 2019,7.4,"Prue and Paul set some tricky challenges for the remaining bakers, including a Technical that dates back to Henry VIII and a Showstopper that's usually found at Indian weddings."
10,5,The Roaring Twenties,24 Sep. 2019,6.6,Contestants must create confectionery inspired by the Roaring Twenties.
10,6,Dessert Week,1 Oct. 2019,7.7,
10,7,Festival Week,8 Oct. 2019,7.6,
10,8,Pastry Week,15 Oct. 2019,7.4,"Jo Brand chats with celebrity Bake Off fans Scarlett Moffatt, Phil Wang and Rob Beckett."
10,9,Semi-Final: Patisserie Week,22 Oct. 2019,7.8,
10,10,Final,29 Oct. 2019,7.5,
10,11,The Great Christmas Bake Off,25 Dec. 2019,0.0,
10,12,The Great Festive Bake Off,1 Jan. 2020,8.3,
11,1,Cake Week,22 Sep. 2020,8.2,"Week one sees the bakers make battenbergs for the signature challenge, attempt pineapple upside down cakes for their technical, and a cake bust for the showstopper."
11,2,Biscuit Week,29 Sep. 2020,7.9,"Week 2 is biscuit week, challenging bakers to make chocolate florentines for the signature, macaroons for the technical, and 3D biscuit sculptures for the showstopper."
11,3,Bread Week,6 Oct. 2020,7.8,The ten bakers have much to prove with a fruity teatime Signature in Bread Week.
11,4,Chocolate Week,13 Oct. 2020,7.8,
11,5,Pastry Week,20 Oct. 2020,7.5,
11,6,Japanese Week,27 Oct. 2020,7.6,
11,7,1980s Week,3 Nov. 2020,0.0,
