temporada,numero,titulo,fecha_estreno,puntuacion,descripcion
1,1,Tu Beer Hai,3 Jun. 2015,9.1,"Naveen is pissed off at his company for not letting him lead a project, for which he worked really hard. His mentor Bhati asks him a fundamental question 'What are you?'. Naveen and his friends discover the answer to it in different ways."
1,2,And Then There Were Four,17 Jun. 2015,8.9,While the whole idea of startup is of 3 friends. Naveen's roommate and IIM graduate Mandal want to enter the team and make the 3 realize why they need him.
1,3,The Jury Room,1 Jul. 2015,9.1,"Now the team is united, ready for their start-up. But, Funding? Investors? Naveen and the guys go around the town looking for investors discovering the plethora of start-ups."
1,4,Bulb Jalega Boss,15 Jul. 2015,9.2,"Naveen, Mandal and Yogi pick up from where they left off to make it or break it at the event under any circumstance, while Jeetu has an agenda of his own to take care at home. The events unfold parallel to each other."
1,5,Where Magic Happens,30 Aug. 2015,9.4,The Team get into a new problem when their idea is hacked by another team and they fight through emotions and misunderstandings to get what they rightfully deserve. Mandal steps up for the team and show his value to the team.
