temporada,numero,titulo,fecha_estreno,puntuacion,descripcion
1,1,Rites of Passage,3 Mar. 2013,7.7,"Ragnar goes on a trip of initiation with his son. Meanwhile, he thinks he has finally found a way to sail ships to the west. However, his beliefs are seen as insane so he chooses to go against the law."
1,2,Wrath of the Northmen,10 Mar. 2013,8.0,The stage is set for the first journey west by Ragnar Lothbrok as he gathers a crew willing to risk their lives to travel into the unknown.
1,3,Dispossessed,17 Mar. 2013,8.1,"After his successful raid, Ragnar and his crew joyously return home with their riches. Earl Haraldson doesn't hesitate to summon Ragnar to the great hall where he lays claim to the entirety of the treasure. He allows the crew to take one thing from the hoard and Ragnar selects Brother Athelstan as his slave. From Athelstan, he learns the political structure in England and wants to learn some of the language. Haraldson sanctions a new raid but insists that one of his men, Knute, join Ragnar's crew. Ragnar takes his wife this time and surprises everyone by putting ..."
1,4,Trial,24 Mar. 2013,8.3,The Vikings head back to England to see what other treasures this new world has to offer. This go round Ragnar and his crew sail out with Earl Haraldson's permission.
1,5,Raid,31 Mar. 2013,8.3,"In the Great Hall of Kattegat, a seer reads Earl Haraldson's future and tells him that Ragnar Lothbrok searches for his death."
1,6,Burial of the Dead,7 Apr. 2013,8.3,"Ragnar, weak and still hurt, must meet the Earl head-on after it comes to light that Rollo has been tortured on Haraldson's orders."
1,7,A King's Ransom,14 Apr. 2013,8.5,Three Viking ships sail upriver towards the very heart of power in eastern England: the Royal Villa of King Aelle.
1,8,Sacrifice,21 Apr. 2013,7.8,"The traditional pilgrimage to Uppsala to thank the gods brings a torrent of emotions for Ragnar, Lagertha, and Athelstan."
1,9,All Change,28 Apr. 2013,7.8,"At the behest of King Horik, Ragnar assembles a small party to travel to Gotaland (modern day Sweden) to resolve a land dispute with the area's leader, Jarl Borg."
2,1,Brother's War,27 Feb. 2014,8.7,"The battle begins between Ragnar and King Horik's forces against Jarl Borg. Borg is joined by Rollo, and this Viking clash pits brother against brother."
2,2,Invasion,6 Mar. 2014,8.3,"Four peaceful years have since passed with Ragnar as Earl. The time has come for an unlikely alliance to band together in pursuit of a common goal - a new raid on England. A storm pushes the Viking fleet to a new destination, and on the beaches of Wessex, Ragnar and his men may have met their match."
2,3,Treachery,13 Mar. 2014,8.6,"The Wessex Viking raid is in full swing and King Ecbert finds himself facing an entirely new kind of foe. While Ragnar races to dominate in the West, Jarl Borg has his own plans in store for the future of Kattegat."
2,4,Eye for an Eye,20 Mar. 2014,8.5,A meeting between two great men may pave the way for future compromise as Ragnar and Ecbert come face to face. Jarl Borg now rules Kattegat and with an iron fist and Rollo must now become the leader his people need in Ragnar's absence.
2,5,Answers in Blood,27 Mar. 2014,8.6,Lagertha and Ragnar unite once again; Aslaug must face the truth of her prophecies; Athelstan struggles to define his faith; Bjorn must once again make a choice.
2,6,Unforgiven,3 Apr. 2014,8.6,King Horik returns to Kattegat with a surprising proposition for Ragnar; Lagertha runs into a less than enthusiastic homecoming from her new husband; Athelstan becomes confidant to King Ecbert.
2,7,Blood Eagle,10 Apr. 2014,8.6,Ragnar and King Horik clash over differences; King Aelle arrives in Wessex; Ecbert has an eye on a new alliance.
2,8,Boneless,17 Apr. 2014,8.1,Princess Aslaug's latest prophecy comes to fruition; Ragnar and Horik have very different ideas about the true purpose of their trip to Wessex.
2,9,The Choice,24 Apr. 2014,8.7,Ragnar's warriors march on to King Ecbert's villa and are met with a vicious surprise.
2,10,The Lord's Prayer,1 May 2014,9.3,Ragnar returns to Kattegat after the defeat in Wessex and places his trust in those who have stayed by his side all this time.
3,1,Mercenary,19 Feb. 2015,8.7,Ragnar and Lagertha's fleets depart Kattegat once more for Wessex but this time they bring settlers.
3,2,The Wanderer,26 Feb. 2015,8.2,Lagertha and Athelstan help to set up the Viking settlement; a mysterious wanderer turns up.
3,3,Warrior's Fate,5 Mar. 2015,8.3,King Ecbert visits the developing Viking settlement as the first harvest is sown.
3,4,Scarred,12 Mar. 2015,8.2,"There is bitterness in the camp, Floki is angry over the alliance with Ecbert."
3,5,The Usurper,19 Mar. 2015,8.5,The fleet returns to Kattegat to discover tragic circumstances await.
3,6,Born Again,26 Mar. 2015,8.8,"Preparations for the Paris raid pick up speed, and Rollo thinks about the Seer's prophecy."
3,7,Paris,2 Apr. 2015,8.1,The Viking fleet causes panic in Paris; the Emperor Charles declares he will remain in the city.
3,8,To the Gates!,9 Apr. 2015,9.3,The Viking army sets out and Paris goes into lockdown as the army prepares the defense.
3,9,Breaking Point,16 Apr. 2015,8.8,The Vikings hit Paris with a second assault; Emperor Charles has to make a difficult decision.
3,10,The Dead,23 Apr. 2015,9.2,"With one last chance to take Paris, Ragnar and his Viking troops take a daring chance. Ragnar asks Bjorn for a favor that could change the course of Viking history."
4,1,A Good Treason,18 Feb. 2016,8.6,"As Ragnar lies in his sick bed in Kattegat, events unfold beyond his control."
4,2,Kill the Queen,25 Feb. 2016,8.4,"Ragnar and Floki are still at odds; Rollo makes great attempts to win over his new bride, Princess Gisla; Bjorn's survival skills are put to the test; King Ecbert sets the task for his son Aethelwulf to rescue Queen Kwenthrith."
4,3,Mercy,3 Mar. 2016,8.1,Ragnar tells Floki he has to pay a heavy price for his actions. Rollo finds an ally in Count Odo. Bjorn Ironside finds more than he bargained for in the wilderness.
4,4,Yol,10 Mar. 2016,8.2,Ragnar gets to know the new slave woman while Rollo reveals his ambitions to his wife. Bjorn meets an unexpected warrior on his way home.
4,5,Promised,17 Mar. 2016,7.9,Halfdan the Black arrives in Kattegat. Floki reveals a secret to Finehair. Ragnar and Yidu become closer. Meanwhile Lagertha settles a score.
4,6,What Might Have Been,24 Mar. 2016,8.1,"Ragnar reveals his plan to raid Paris again, and although the fleet is storm-tossed as it sets out, the challenge lies in Frankia where Rollo awaits. Meanwhile, Ecbert dispatches Aethelwulf and Alfred on a pilgrimage to Rome."
4,7,The Profit and the Loss,31 Mar. 2016,8.5,"Now aware that Rollo has betrayed him, Ragnar carries out his plan of attack, which has dire consequences. Ecbert is given an offer from Prince Wigstan of Mercia. Harbard causes a stir with the women of Kattegat."
4,8,Portage,7 Apr. 2016,8.3,"After facing defeat on the river, Ragnar refuses to retreat, prompting him to change his methods of attacking Paris. Count Odo's plot against Charles and Rollo backfires. Ecbert now rules Mercia, which dissatisfies Kwenthrith."
4,9,Death All 'Round,14 Apr. 2016,8.2,The Vikings finally reach the river. Aethelwulf and Alfred reach Rome. Erlendur makes his move against Bjorn. Sigurd makes a shocking discovery in Kattegat. Ecbert is crowned king in Mercia.
4,10,The Last Ship,21 Apr. 2016,9.2,A ferocious battle between the Vikings and the Franks eventually comes down to Ragnar against Rollo. The outcome will seal the fate of the two brothers.
4,11,The Outsider,30 Nov. 2016,8.2,Ragnar has returned to Kattegat where he devises a plan to return to Wessex to right past wrongs.
4,12,The Vision,7 Dec. 2016,8.1,"Ragnar seeks to equip his voyage to Wessex, even while being warned that the gods have deserted him. Bjorn prepares to fulfill his dream of exploring the Mediterranean."
4,13,Two Journeys,14 Dec. 2016,8.4,Ragnar and Ivar face a difficult decision in regards to their crew; Bjorn has an unexpected reunion.
4,14,In the Uncertain Hour Before the Morning,21 Dec. 2016,8.9,Lagertha attempts to fulfill a long-held ambition; Ragnar negotiates an unexpected concession from King Ecbert.
4,15,All His Angels,28 Dec. 2016,9.6,King Aelle can't hide his pleasure when Ragnar arrives in a cage and shows him no mercy.
4,16,Crossings,4 Jan. 2017,8.6,"Bjorn's fleet sails onward and launches a surprise attack. Back in Kattegat, Lagertha continues in her quest for power."
4,17,The Great Army,11 Jan. 2017,8.2,"The Great Army is gathering in Kattegat, as Lagertha is saved by Bjorn Ironside from the hands of Ragnar's sons. Rollo is establishing the kingdom of Normandie as a safe-heaven for all vikings in search for land."
4,18,Revenge,18 Jan. 2017,8.9,Ragnar's plan comes to fruition; the Viking army lands on the coast of Northumbria.
4,19,On the Eve,25 Jan. 2017,9.0,The Viking army causes panic in the English countryside as King Ecbert and Aethelwulf plan the defense of the Kingdom of Wessex.
4,20,The Reckoning,1 Feb. 2017,8.9,Prince Aethelwulf finds himself subject to the Vikings' battle master plan; Ecbert remains behind with a plan of his own.
5,1,The Fisher King,5 Dec. 2017,8.1,"Guided by Bishop Heahmund's visions, the Saxons devise a battle plan. Ivar the Boneless strategizes on his own as the Vikings undergo increasing pressure. Bjorn Ironside finds himself in a new territory and must convince the local commander he is a trader and not a raider."
5,2,The Departed,29 Nov. 2017,8.1,"As the Vikings establish their stronghold in York, Ivar is determined to lead the Great Army. In Kattegat, Lagertha misjudges King Harald and pays a heavy price. Floki arrives at a mysterious land."
5,3,Homeland,6 Dec. 2017,8.7,"Celebrations are cut short in the aftermath of the battle at York; Ragnar Lothbrok's sons are pitted against each other as tensions reach an all-time high, and each one is forced to choose a side."
5,4,The Plan,13 Dec. 2017,8.0,"Guided by Bishop Heahmund's visions, the Saxons devise a battle plan. Ivar the Boneless strategizes on his own as the Vikings undergo increasing pressure. Bjorn Ironside finds himself in a new territory and must convince the local commander he is a trader and not a raider."
5,5,The Prisoner,20 Dec. 2017,8.3,Ivar meets his match in Bishop Heahmund. Floki returns to Kattegat. Bjorn receives a lavish welcome in North Africa.
5,6,The Message,27 Dec. 2017,8.0,"Lagertha is betrayed, and Bjorn must find a way to support the distraught queen; Floki and his settlers arrive in a new land, but it is far from what they expected."
5,7,Full Moon,3 Jan. 2018,7.7,Bjorn returns to Kattegat to learn that an attack will take place during the next full moon; Ivar must decide if he can place his trust in a former enemy on the battlefield.
5,8,The Joke,10 Jan. 2018,8.7,"The battle for Kattegat begins. As the two armies line up to fight, the Great Heathen Army must decide between a final plea for peace or all-out war. Floki faces discord amongst the settlers."
5,9,A Simple Story,17 Jan. 2018,7.5,"The army leaders consider their options in the aftermath of the battle. In Floki's camp, all hopes of binding the community together are dashed as tragedy unfolds."
5,10,Moments of Vision,24 Jan. 2018,7.4,"A sense of doom looms over Kattegat as bloodshed ensues, but as the defeated army flees in the face of the victors, a legendary warrior makes his way home."
5,11,The Revelation,28 Nov. 2018,7.7,"Ivar is crowned the new king of Kattegat just in time to welcome Rollo home; Bjorn, Lagertha and Ubbe must rely on unsteady alliances to survive."
5,12,Murder Most Foul,5 Dec. 2018,7.8,"Bjorn, Lagertha and Ubbe face an uncertain fate as Heahmund's loyalty is tested; Floki fights to understand the will of the gods in Iceland; Ivar may have met his match in Kattegat."
5,13,A New God,12 Dec. 2018,7.2,"Heahmund must convince King Alfred that his actions are in defense of the crown; Ubbe and Torvi strengthen the position of the Vikings, but not all in the Viking camp support their strategy; another settler disappears in Iceland."
5,14,The Lost Moment,19 Dec. 2018,7.2,King Harald and his army approaches Wessex while Aethelred is about to make a huge decision about his brother's fate.
5,15,Hell,26 Dec. 2018,8.7,Bishop Heahmund is wracked with guilt as he fights to renounce his passions. Viking will clash with Saxon on the battlefield leaving a key figure lost in the balance.
5,16,The Buddha,2 Jan. 2019,7.8,"Ubbe achieves one of Ragnar's dreams; Ivar hatches a new plan in Kattegat, while preparing for a divine arrival; a settler in Iceland returns in a terrible state; King Alfred faces his greatest threat yet."
5,17,The Most Terrible Thing,9 Jan. 2019,7.0,"An unexpected turn among the settlers leaves Floki powerless. King Alfred confronts Judith. Bjorn must strike a deal with Harald. Wessex is once again threatened by a Viking force, but who will lead the Saxon army to defend the Realm?"
5,18,Baldur,16 Jan. 2019,7.7,"Hvitserk is severely tested. Floki makes an amazing discovery. Freydis gives Ivar a surprise. Ubbe negotiates with the three Danish Kings that have massed their armies in Reading, but the negotiations may have a perilous outcome."
5,19,What Happens in the Cave,23 Jan. 2019,8.0,Ubbe is forced into hand-to-hand combat. Floki reaches new depths and is met by a shocking sight. Bjorn sets off for Scandinavia with an old rival.
5,20,Ragnarok,30 Jan. 2019,8.8,A new battle for Kattegat is on and only the gods know who will emerge victorious.
6,1,New Beginnings,4 Dec. 2019,7.6,"Bjorn struggles with the responsibilities of kingship and finds he can't rely on his mother, Lagertha; she has other plans. Ivar falls into the hands of Kievan Rus, and in their ruthless and unpredictable ruler, Prince Oleg, he may finally have met his match."
6,2,The Prophet,4 Dec. 2019,7.6,"Messengers arrive in Kattegat with news that presents Bjorn with a dilemma. As Bjorn attempts to do the right thing as ruler of Kattegat, Prince Oleg of Kiev seems untroubled by his conscience."
6,3,"Ghosts, Gods and Running Dogs",11 Dec. 2019,7.5,"Lagertha is forced to take action; In Kiev, although Oleg continues to be friendly, Ivar is aware of the threat which Oleg poses to the vulnerable young heir to the throne; Bjorn has answered the call and come to the aid of an old enemy."
6,4,All the Prisoners,18 Dec. 2019,7.6,"Lagertha leads her village's response to the recent attacks but despite her best efforts, when the inevitable attack comes, the consequences are tragic. Olaf has a bold new plan for the future of Norway. In Kiev, although Ivar discusses Oleg's ambitions for Scandinavia, he's actually more interested in the plight of Igor, the young heir who Oleg controls."
6,5,The Key,1 Jan. 2020,6.8,"Norway's Kings and Jarls arrive at Harald's territory for the election of the King of all Norway, while King Olaf is confident of the result, the election may not run as smoothly as he thinks."
6,6,Death and the Serpent,8 Jan. 2020,8.3,"Bjorn is forced to act quickly in the aftermath of the election for the King of all Norway. The bandits attack Lagertha's village again, confident of victory. But when the defense boils down to single combat with Lagertha, victory for the bandits looks less certain. Back in Kattegat, haunted and paranoid, Hvitserk continues to unravel."
6,7,The Ice Maiden,15 Jan. 2020,8.4,"Bjorn returns to Kattegat; Harald gains a measure of revenge on Olaf; in Kiev, interesting news reaches Ivar and Igor about Prince Dir."
6,8,Valhalla Can Wait,22 Jan. 2020,7.7,"Bjorn faces a difficult decision. Ubbe and Torvi leave Kattegat, in search of new lands and perhaps old friends. Oleg's plans for the invasion of Scandinavia are taking shape, and King Harald is baffled by the origin of a mysterious raiding party."
6,9,Resurrection,29 Jan. 2020,7.4,"Ubbe and Torvi are able to meet their unknown wanderer while in Iceland; Bjorn reconsiders who his enemies truly are after Erik's scouting mission,which prompts him to convince an old nemesis to join him; Ivar reunites with a close figure."
6,10,The Best Laid Plans,5 Feb. 2020,7.5,"While Ivar and Igor continue to plot against Oleg, Kings Harald and Bjorn make frantic preparations to defend against the invasion,but the efforts of their quick work remain to be seen."
6,11,Episode #6.11,2020,,
6,12,Episode #6.12,2020,,
6,13,Episode #6.13,2020,,
6,14,Episode #6.14,2020,,
6,15,Episode #6.15,2020,,
6,16,Episode #6.16,2020,,
6,17,Episode #6.17,2020,,
6,18,Episode #6.18,2020,,
6,19,Episode #6.19,2020,,
6,20,Episode #6.20,2020,,
7,1,New Beginnings,4 Dec. 2019,7.6,"Bjorn struggles with the responsibilities of kingship and finds he can't rely on his mother, Lagertha; she has other plans. Ivar falls into the hands of Kievan Rus, and in their ruthless and unpredictable ruler, Prince Oleg, he may finally have met his match."
7,2,The Prophet,4 Dec. 2019,7.6,"Messengers arrive in Kattegat with news that presents Bjorn with a dilemma. As Bjorn attempts to do the right thing as ruler of Kattegat, Prince Oleg of Kiev seems untroubled by his conscience."
7,3,"Ghosts, Gods and Running Dogs",11 Dec. 2019,7.5,"Lagertha is forced to take action; In Kiev, although Oleg continues to be friendly, Ivar is aware of the threat which Oleg poses to the vulnerable young heir to the throne; Bjorn has answered the call and come to the aid of an old enemy."
7,4,All the Prisoners,18 Dec. 2019,7.6,"Lagertha leads her village's response to the recent attacks but despite her best efforts, when the inevitable attack comes, the consequences are tragic. Olaf has a bold new plan for the future of Norway. In Kiev, although Ivar discusses Oleg's ambitions for Scandinavia, he's actually more interested in the plight of Igor, the young heir who Oleg controls."
7,5,The Key,1 Jan. 2020,6.8,"Norway's Kings and Jarls arrive at Harald's territory for the election of the King of all Norway, while King Olaf is confident of the result, the election may not run as smoothly as he thinks."
7,6,Death and the Serpent,8 Jan. 2020,8.3,"Bjorn is forced to act quickly in the aftermath of the election for the King of all Norway. The bandits attack Lagertha's village again, confident of victory. But when the defense boils down to single combat with Lagertha, victory for the bandits looks less certain. Back in Kattegat, haunted and paranoid, Hvitserk continues to unravel."
7,7,The Ice Maiden,15 Jan. 2020,8.4,"Bjorn returns to Kattegat; Harald gains a measure of revenge on Olaf; in Kiev, interesting news reaches Ivar and Igor about Prince Dir."
7,8,Valhalla Can Wait,22 Jan. 2020,7.7,"Bjorn faces a difficult decision. Ubbe and Torvi leave Kattegat, in search of new lands and perhaps old friends. Oleg's plans for the invasion of Scandinavia are taking shape, and King Harald is baffled by the origin of a mysterious raiding party."
7,9,Resurrection,29 Jan. 2020,7.4,"Ubbe and Torvi are able to meet their unknown wanderer while in Iceland; Bjorn reconsiders who his enemies truly are after Erik's scouting mission,which prompts him to convince an old nemesis to join him; Ivar reunites with a close figure."
7,10,The Best Laid Plans,5 Feb. 2020,7.5,"While Ivar and Igor continue to plot against Oleg, Kings Harald and Bjorn make frantic preparations to defend against the invasion,but the efforts of their quick work remain to be seen."
7,11,Episode #6.11,2020,,
7,12,Episode #6.12,2020,,
7,13,Episode #6.13,2020,,
7,14,Episode #6.14,2020,,
7,15,Episode #6.15,2020,,
7,16,Episode #6.16,2020,,
7,17,Episode #6.17,2020,,
7,18,Episode #6.18,2020,,
7,19,Episode #6.19,2020,,
7,20,Episode #6.20,2020,,
